,review_id,business_id,user_id,stars,blob_polarity,review
271939,8TisWr5lAR6scdkjFJsYkw,4hmmTmWdC2d7kXhCmWZ8kg,N-D-d1Z4UybdlkK1HxlNPA,2,0.4,"the passageways were just too crowded and filled with screaming children, and their cacophony echoed off of the tanks and cave-like interior"
271940,8TisWr5lAR6scdkjFJsYkw,4hmmTmWdC2d7kXhCmWZ8kg,N-D-d1Z4UybdlkK1HxlNPA,2,0,save your money and take the family on a trip to san diego
271941,JdFzCRcopbhXYcdyhPJpAA,4hmmTmWdC2d7kXhCmWZ8kg,15XeMN1h7qEUxj1bNnOtcQ,4,0,http://www
271942,JdFzCRcopbhXYcdyhPJpAA,4hmmTmWdC2d7kXhCmWZ8kg,15XeMN1h7qEUxj1bNnOtcQ,4,0,youtube
271943,JdFzCRcopbhXYcdyhPJpAA,4hmmTmWdC2d7kXhCmWZ8kg,15XeMN1h7qEUxj1bNnOtcQ,4,0,com/watch?v=vj9mlnke2eq
271944,JdFzCRcopbhXYcdyhPJpAA,4hmmTmWdC2d7kXhCmWZ8kg,15XeMN1h7qEUxj1bNnOtcQ,4,0.5,i have seen many aquariums all over the u
271945,JdFzCRcopbhXYcdyhPJpAA,4hmmTmWdC2d7kXhCmWZ8kg,15XeMN1h7qEUxj1bNnOtcQ,4,0.229166667,"being raised near the ocean, and living in az for 10 years made me very excited to have an aquarium near my home"
271946,JdFzCRcopbhXYcdyhPJpAA,4hmmTmWdC2d7kXhCmWZ8kg,15XeMN1h7qEUxj1bNnOtcQ,4,1,"if you go to sealife aquarium with the frame of mind that this is meant for children, and have a childlike attitude, you will have a wonderful time"
271947,JdFzCRcopbhXYcdyhPJpAA,4hmmTmWdC2d7kXhCmWZ8kg,15XeMN1h7qEUxj1bNnOtcQ,4,0,(geared for under 12  i would say) be prepared for lots of crawling and stooping if you want to see it all
271948,JdFzCRcopbhXYcdyhPJpAA,4hmmTmWdC2d7kXhCmWZ8kg,15XeMN1h7qEUxj1bNnOtcQ,4,0.1,my 18 year old daughter and i decided to try it out
271949,JdFzCRcopbhXYcdyhPJpAA,4hmmTmWdC2d7kXhCmWZ8kg,15XeMN1h7qEUxj1bNnOtcQ,4,0,we arrived at  3:30pm on a friday
271950,JdFzCRcopbhXYcdyhPJpAA,4hmmTmWdC2d7kXhCmWZ8kg,15XeMN1h7qEUxj1bNnOtcQ,4,0.5,we were very happy there were only a couple of families in line
271951,JdFzCRcopbhXYcdyhPJpAA,4hmmTmWdC2d7kXhCmWZ8kg,15XeMN1h7qEUxj1bNnOtcQ,4,0,i bought my discount tickets ahead of time at www
271952,JdFzCRcopbhXYcdyhPJpAA,4hmmTmWdC2d7kXhCmWZ8kg,15XeMN1h7qEUxj1bNnOtcQ,4,0,ticketsatwork
271953,JdFzCRcopbhXYcdyhPJpAA,4hmmTmWdC2d7kXhCmWZ8kg,15XeMN1h7qEUxj1bNnOtcQ,4,0,com
271954,JdFzCRcopbhXYcdyhPJpAA,4hmmTmWdC2d7kXhCmWZ8kg,15XeMN1h7qEUxj1bNnOtcQ,4,0.5,so glad i did
271955,JdFzCRcopbhXYcdyhPJpAA,4hmmTmWdC2d7kXhCmWZ8kg,15XeMN1h7qEUxj1bNnOtcQ,4,-0.009166667,i found the regular pricing a little high
271956,JdFzCRcopbhXYcdyhPJpAA,4hmmTmWdC2d7kXhCmWZ8kg,15XeMN1h7qEUxj1bNnOtcQ,4,-0.1,we only had to share each exhibit with a few people coming and going
271957,JdFzCRcopbhXYcdyhPJpAA,4hmmTmWdC2d7kXhCmWZ8kg,15XeMN1h7qEUxj1bNnOtcQ,4,0.05,"it did not take too long to get through the whole thing, so we went back through"
271958,JdFzCRcopbhXYcdyhPJpAA,4hmmTmWdC2d7kXhCmWZ8kg,15XeMN1h7qEUxj1bNnOtcQ,4,0.6,the design was amazing
271959,JdFzCRcopbhXYcdyhPJpAA,4hmmTmWdC2d7kXhCmWZ8kg,15XeMN1h7qEUxj1bNnOtcQ,4,0,all the shapes and curves of the aquariums made the fish look bigger
271960,JdFzCRcopbhXYcdyhPJpAA,4hmmTmWdC2d7kXhCmWZ8kg,15XeMN1h7qEUxj1bNnOtcQ,4,0.2,i missed the real coral
271961,JdFzCRcopbhXYcdyhPJpAA,4hmmTmWdC2d7kXhCmWZ8kg,15XeMN1h7qEUxj1bNnOtcQ,4,0.25,"much of plastic plants and coral were way too colorful, and reminded me of the submarine ride at disneyland"
271962,JdFzCRcopbhXYcdyhPJpAA,4hmmTmWdC2d7kXhCmWZ8kg,15XeMN1h7qEUxj1bNnOtcQ,4,0,"once again, designed for children"
271963,JdFzCRcopbhXYcdyhPJpAA,4hmmTmWdC2d7kXhCmWZ8kg,15XeMN1h7qEUxj1bNnOtcQ,4,0.6,"the touch pool was nice, but at seaworld they let you hold the starfish not just touch them"
271964,JdFzCRcopbhXYcdyhPJpAA,4hmmTmWdC2d7kXhCmWZ8kg,15XeMN1h7qEUxj1bNnOtcQ,4,0.166666667,"if fishermen can cut them in half, and they grow into 2 starfish, i am sure it won't kill them to be held by supervised children"
271965,JdFzCRcopbhXYcdyhPJpAA,4hmmTmWdC2d7kXhCmWZ8kg,15XeMN1h7qEUxj1bNnOtcQ,4,0.7,"we loved ""the tube"""
271966,JdFzCRcopbhXYcdyhPJpAA,4hmmTmWdC2d7kXhCmWZ8kg,15XeMN1h7qEUxj1bNnOtcQ,4,1,"the glass floor was so etched you could not see out the bottom, but the effect was wonderful"
271967,JdFzCRcopbhXYcdyhPJpAA,4hmmTmWdC2d7kXhCmWZ8kg,15XeMN1h7qEUxj1bNnOtcQ,4,0.253787879,to be one of the very first people to walk through the tube when the glass was new would be an exciting experience
271968,JdFzCRcopbhXYcdyhPJpAA,4hmmTmWdC2d7kXhCmWZ8kg,15XeMN1h7qEUxj1bNnOtcQ,4,0.8,"the ""shark"" expert was excellent and sat with the kids and was kind and patient"
271969,JdFzCRcopbhXYcdyhPJpAA,4hmmTmWdC2d7kXhCmWZ8kg,15XeMN1h7qEUxj1bNnOtcQ,4,0.13,"he was very young, all employees were"
271970,JdFzCRcopbhXYcdyhPJpAA,4hmmTmWdC2d7kXhCmWZ8kg,15XeMN1h7qEUxj1bNnOtcQ,4,0,"the aquarium exits to a play area, and to what else but the gift shop"
271971,JdFzCRcopbhXYcdyhPJpAA,4hmmTmWdC2d7kXhCmWZ8kg,15XeMN1h7qEUxj1bNnOtcQ,4,0.153333333,all in all it was a great experience for this bored arizonian who misses the ocean and can't afford a high priced vacation to san diego this year
271972,JdFzCRcopbhXYcdyhPJpAA,4hmmTmWdC2d7kXhCmWZ8kg,15XeMN1h7qEUxj1bNnOtcQ,4,1,"for those who have never seen a shark, jelly fish or seahorse this is a wonderful place to do it"
271973,JdFzCRcopbhXYcdyhPJpAA,4hmmTmWdC2d7kXhCmWZ8kg,15XeMN1h7qEUxj1bNnOtcQ,4,0.33125,"being an artist, i appreciate all of the work that went into this beautiful little aquarium"
271974,JdFzCRcopbhXYcdyhPJpAA,4hmmTmWdC2d7kXhCmWZ8kg,15XeMN1h7qEUxj1bNnOtcQ,4,0,(see link above) i do admonish those on a budget to look for coupons though
271975,JdFzCRcopbhXYcdyhPJpAA,4hmmTmWdC2d7kXhCmWZ8kg,15XeMN1h7qEUxj1bNnOtcQ,4,0.5,:)
271976,OHRpfz0PVRvwBPwU4qSLnQ,4hmmTmWdC2d7kXhCmWZ8kg,GrSixRnGIxNUJ1Cn5DNX9A,2,-0.3,i suppose that living 5 hours from the nearest oceans makes us suckers for these things
271977,OHRpfz0PVRvwBPwU4qSLnQ,4hmmTmWdC2d7kXhCmWZ8kg,GrSixRnGIxNUJ1Cn5DNX9A,2,0.2125,it is a nice enough place to take the kids on a lazy afternoon but at these prices you would expect more
271978,OHRpfz0PVRvwBPwU4qSLnQ,4hmmTmWdC2d7kXhCmWZ8kg,GrSixRnGIxNUJ1Cn5DNX9A,2,0,maybe staged shark attacks or talking orcas
271979,OHRpfz0PVRvwBPwU4qSLnQ,4hmmTmWdC2d7kXhCmWZ8kg,GrSixRnGIxNUJ1Cn5DNX9A,2,0,the place has a ways to go
271980,OHRpfz0PVRvwBPwU4qSLnQ,4hmmTmWdC2d7kXhCmWZ8kg,GrSixRnGIxNUJ1Cn5DNX9A,2,-0.2,they kind of made the ocean boring
271981,gSuWEMOM03MQW2jMPHwmiw,4hmmTmWdC2d7kXhCmWZ8kg,h9d3VW5RTJymoFoLnN60_w,2,0.05,i saw the freeway ad about the aquarium a while back and decided to check it out with my two year old today
271982,gSuWEMOM03MQW2jMPHwmiw,4hmmTmWdC2d7kXhCmWZ8kg,h9d3VW5RTJymoFoLnN60_w,2,0.125,i waited to avoid the crowds and i'm glad i did as the place is small
271983,gSuWEMOM03MQW2jMPHwmiw,4hmmTmWdC2d7kXhCmWZ8kg,h9d3VW5RTJymoFoLnN60_w,2,0,"also, we got in as soon as they opened"
271984,gSuWEMOM03MQW2jMPHwmiw,4hmmTmWdC2d7kXhCmWZ8kg,h9d3VW5RTJymoFoLnN60_w,2,0,"i didn't had my stroller, but  can see how when it's crowded it must be a pain to use"
271985,gSuWEMOM03MQW2jMPHwmiw,4hmmTmWdC2d7kXhCmWZ8kg,h9d3VW5RTJymoFoLnN60_w,2,0.25,"first, it's overpriced"
271986,gSuWEMOM03MQW2jMPHwmiw,4hmmTmWdC2d7kXhCmWZ8kg,h9d3VW5RTJymoFoLnN60_w,2,0,$18 
271987,gSuWEMOM03MQW2jMPHwmiw,4hmmTmWdC2d7kXhCmWZ8kg,h9d3VW5RTJymoFoLnN60_w,2,0,"50 adults, $10"
271988,gSuWEMOM03MQW2jMPHwmiw,4hmmTmWdC2d7kXhCmWZ8kg,h9d3VW5RTJymoFoLnN60_w,2,0,50 kids
271989,gSuWEMOM03MQW2jMPHwmiw,4hmmTmWdC2d7kXhCmWZ8kg,h9d3VW5RTJymoFoLnN60_w,2,0.07,i wouldn't mind (as much) if it was at least a whole day experience but you're in and out in one hour! i'm glad at least i didn't had to pay for my son
271990,gSuWEMOM03MQW2jMPHwmiw,4hmmTmWdC2d7kXhCmWZ8kg,h9d3VW5RTJymoFoLnN60_w,2,-0.25,"inside is disney-like, with the low lights, fake treasure chest and what not"
271991,gSuWEMOM03MQW2jMPHwmiw,4hmmTmWdC2d7kXhCmWZ8kg,h9d3VW5RTJymoFoLnN60_w,2,0,they had someone painting some wood that was in front of a tank
271992,gSuWEMOM03MQW2jMPHwmiw,4hmmTmWdC2d7kXhCmWZ8kg,h9d3VW5RTJymoFoLnN60_w,2,-0.1,"it had a "" don't touch wet paint"" sign"
271993,gSuWEMOM03MQW2jMPHwmiw,4hmmTmWdC2d7kXhCmWZ8kg,h9d3VW5RTJymoFoLnN60_w,2,0,"huh? there's tons of kids that are bound to touch it, sign or not"
271994,gSuWEMOM03MQW2jMPHwmiw,4hmmTmWdC2d7kXhCmWZ8kg,h9d3VW5RTJymoFoLnN60_w,2,0,i think that they could have painted during closing hours
271995,gSuWEMOM03MQW2jMPHwmiw,4hmmTmWdC2d7kXhCmWZ8kg,h9d3VW5RTJymoFoLnN60_w,2,0.5,my son's favorite  was the ray/shark tank
271996,gSuWEMOM03MQW2jMPHwmiw,4hmmTmWdC2d7kXhCmWZ8kg,h9d3VW5RTJymoFoLnN60_w,2,0.175,"there's several ""go inside the tank"" experiences that were cool"
271997,gSuWEMOM03MQW2jMPHwmiw,4hmmTmWdC2d7kXhCmWZ8kg,h9d3VW5RTJymoFoLnN60_w,2,0.34375,"my son was asking to leave, that was a first! there were kids every age in there and none seemed too excited"
271998,gSuWEMOM03MQW2jMPHwmiw,4hmmTmWdC2d7kXhCmWZ8kg,h9d3VW5RTJymoFoLnN60_w,2,-0.029166667,"there's a little play area at the end, but it was warm and uncomfortable"
271999,gSuWEMOM03MQW2jMPHwmiw,4hmmTmWdC2d7kXhCmWZ8kg,h9d3VW5RTJymoFoLnN60_w,2,-1,"i agree with someone before who said they made the ocean boring, hehe"
272000,3vOJAXD7BKoU5R9yMPQ00g,4hmmTmWdC2d7kXhCmWZ8kg,ZoiBl0VS-36RXokRTJPlSw,4,1,"aside from things that sea life aquarium cannot control (strollers in the way, morbidly obese blocking exhibits talking while a crowd of children are trying to look at them, etc) the aquarium is awesome"
272001,3vOJAXD7BKoU5R9yMPQ00g,4hmmTmWdC2d7kXhCmWZ8kg,ZoiBl0VS-36RXokRTJPlSw,4,0,my daughter and nephew had a blast
272002,3vOJAXD7BKoU5R9yMPQ00g,4hmmTmWdC2d7kXhCmWZ8kg,ZoiBl0VS-36RXokRTJPlSw,4,0.322222222,"a ton of great exhibits, decently priced admission (currently $18 for adults), and a knowledgeable staff"
272003,3vOJAXD7BKoU5R9yMPQ00g,4hmmTmWdC2d7kXhCmWZ8kg,ZoiBl0VS-36RXokRTJPlSw,4,0.2,"and for you out there expecting this to be some world class aquarium, get real"
272004,3vOJAXD7BKoU5R9yMPQ00g,4hmmTmWdC2d7kXhCmWZ8kg,ZoiBl0VS-36RXokRTJPlSw,4,0,"it is in a shopping mall, why would you expect it to be? "
272005,3vOJAXD7BKoU5R9yMPQ00g,4hmmTmWdC2d7kXhCmWZ8kg,ZoiBl0VS-36RXokRTJPlSw,4,0.8,"for what it is, its really great"
272006,3vOJAXD7BKoU5R9yMPQ00g,4hmmTmWdC2d7kXhCmWZ8kg,ZoiBl0VS-36RXokRTJPlSw,4,-0.2,i would recommend this to anyone with kids as something to kill a few hours
272007,zpsVUPQXeq9iyfEiPf0PHw,4hmmTmWdC2d7kXhCmWZ8kg,8CNEh7fSbLwDuAKhLjDPKQ,2,0.09,"good for young kids, not good for aquarium aficionados or people who like oceanariums, lots of fish, big viewing areas and quiet museum-like experiences"
272008,zpsVUPQXeq9iyfEiPf0PHw,4hmmTmWdC2d7kXhCmWZ8kg,8CNEh7fSbLwDuAKhLjDPKQ,2,0.6,"perhaps i'm spoiled growing up in the north burbs of chicago and having a pass to the shedd aquarium my whole life, and seeing some of the best aquariums across the country but"
272009,zpsVUPQXeq9iyfEiPf0PHw,4hmmTmWdC2d7kXhCmWZ8kg,8CNEh7fSbLwDuAKhLjDPKQ,2,0,sealife didn't do anything for me
272010,zpsVUPQXeq9iyfEiPf0PHw,4hmmTmWdC2d7kXhCmWZ8kg,8CNEh7fSbLwDuAKhLjDPKQ,2,-0.5,"i can sort of deal with the price, it's expensive to set this type of thing up and get the fish in and blah blah"
272011,zpsVUPQXeq9iyfEiPf0PHw,4hmmTmWdC2d7kXhCmWZ8kg,8CNEh7fSbLwDuAKhLjDPKQ,2,0,i get it
272012,zpsVUPQXeq9iyfEiPf0PHw,4hmmTmWdC2d7kXhCmWZ8kg,8CNEh7fSbLwDuAKhLjDPKQ,2,0,it's pricey for the experience but i get it - so nothing in my review is based on the price
272013,zpsVUPQXeq9iyfEiPf0PHw,4hmmTmWdC2d7kXhCmWZ8kg,8CNEh7fSbLwDuAKhLjDPKQ,2,-0.1,"a few of the tanks only had a couple fish in them, so i'm assuming they're still populating them"
272014,zpsVUPQXeq9iyfEiPf0PHw,4hmmTmWdC2d7kXhCmWZ8kg,8CNEh7fSbLwDuAKhLjDPKQ,2,-0.083333333,and some of the areas like the circle room with the fish going around the room and above the doors had half the room's windows masked off
272015,zpsVUPQXeq9iyfEiPf0PHw,4hmmTmWdC2d7kXhCmWZ8kg,8CNEh7fSbLwDuAKhLjDPKQ,2,0,unfinished? idk
272016,zpsVUPQXeq9iyfEiPf0PHw,4hmmTmWdC2d7kXhCmWZ8kg,8CNEh7fSbLwDuAKhLjDPKQ,2,0,the starfish thing was roped off when we went but there was a staff person there talking to kids about them
272017,zpsVUPQXeq9iyfEiPf0PHw,4hmmTmWdC2d7kXhCmWZ8kg,8CNEh7fSbLwDuAKhLjDPKQ,2,-0.1875,there was a little movie theatre area showing shark videos
272018,zpsVUPQXeq9iyfEiPf0PHw,4hmmTmWdC2d7kXhCmWZ8kg,8CNEh7fSbLwDuAKhLjDPKQ,2,0,aka discovery channel
272019,zpsVUPQXeq9iyfEiPf0PHw,4hmmTmWdC2d7kXhCmWZ8kg,8CNEh7fSbLwDuAKhLjDPKQ,2,-0.3,that opened up into the room with a somewhat small viewport considering no more than 10 people can look through it at a time without blocking it from behind
272020,zpsVUPQXeq9iyfEiPf0PHw,4hmmTmWdC2d7kXhCmWZ8kg,8CNEh7fSbLwDuAKhLjDPKQ,2,0,dinosaurs hanging from the ceiling
272021,zpsVUPQXeq9iyfEiPf0PHw,4hmmTmWdC2d7kXhCmWZ8kg,8CNEh7fSbLwDuAKhLjDPKQ,2,0.141666667,"okay?  that big viewport looks into the main center tank area, with a shipwreck type of thing"
272022,zpsVUPQXeq9iyfEiPf0PHw,4hmmTmWdC2d7kXhCmWZ8kg,8CNEh7fSbLwDuAKhLjDPKQ,2,0,lots of bigger fish and sharks swimming around
272023,zpsVUPQXeq9iyfEiPf0PHw,4hmmTmWdC2d7kXhCmWZ8kg,8CNEh7fSbLwDuAKhLjDPKQ,2,0,which eventually leads to 'the tunnel'
272024,zpsVUPQXeq9iyfEiPf0PHw,4hmmTmWdC2d7kXhCmWZ8kg,8CNEh7fSbLwDuAKhLjDPKQ,2,-0.075,one side looks into the middle of that big tank and the other side is short with a nearby rock wall; not many fish on that side
272025,zpsVUPQXeq9iyfEiPf0PHw,4hmmTmWdC2d7kXhCmWZ8kg,8CNEh7fSbLwDuAKhLjDPKQ,2,-0.025,"the floor was clear but, even in the short time the aquarium has been open, was scuffed so bad it was pretty much not-see-through"
272026,zpsVUPQXeq9iyfEiPf0PHw,4hmmTmWdC2d7kXhCmWZ8kg,8CNEh7fSbLwDuAKhLjDPKQ,2,0,they'll have to figure that out
272027,zpsVUPQXeq9iyfEiPf0PHw,4hmmTmWdC2d7kXhCmWZ8kg,8CNEh7fSbLwDuAKhLjDPKQ,2,0.015277778,one little black light tank with jellyfish
272028,zpsVUPQXeq9iyfEiPf0PHw,4hmmTmWdC2d7kXhCmWZ8kg,8CNEh7fSbLwDuAKhLjDPKQ,2,0,couple of those bubble things you can crawl under and stick your head up into the middle of the tank for a photo op
272029,zpsVUPQXeq9iyfEiPf0PHw,4hmmTmWdC2d7kXhCmWZ8kg,8CNEh7fSbLwDuAKhLjDPKQ,2,0,couple skinny semi-circle shaped tanks
272030,zpsVUPQXeq9iyfEiPf0PHw,4hmmTmWdC2d7kXhCmWZ8kg,8CNEh7fSbLwDuAKhLjDPKQ,2,-0.1875,one little sea horse viewport
272031,zpsVUPQXeq9iyfEiPf0PHw,4hmmTmWdC2d7kXhCmWZ8kg,8CNEh7fSbLwDuAKhLjDPKQ,2,-0.1875,little lcd panels with info on them for the display
272032,zpsVUPQXeq9iyfEiPf0PHw,4hmmTmWdC2d7kXhCmWZ8kg,8CNEh7fSbLwDuAKhLjDPKQ,2,0.05,felt some areas were bare
272033,zpsVUPQXeq9iyfEiPf0PHw,4hmmTmWdC2d7kXhCmWZ8kg,8CNEh7fSbLwDuAKhLjDPKQ,2,0.222222222,"lots of open room w/ nothing to see, most places except the main ray tank with the overlook balcony"
272034,zpsVUPQXeq9iyfEiPf0PHw,4hmmTmWdC2d7kXhCmWZ8kg,8CNEh7fSbLwDuAKhLjDPKQ,2,0.1,"note, not a petting tank, it's about 5' tall or so but clear all around and lots of rays swimming around and some sharks from what i remember"
272035,zpsVUPQXeq9iyfEiPf0PHw,4hmmTmWdC2d7kXhCmWZ8kg,8CNEh7fSbLwDuAKhLjDPKQ,2,0.45,the walls are colorful and lots of lighting effects going on around every room - nice walls i thought
272036,zpsVUPQXeq9iyfEiPf0PHw,4hmmTmWdC2d7kXhCmWZ8kg,8CNEh7fSbLwDuAKhLjDPKQ,2,0,"being in arizona, of course everything has to be bilingual with spanish"
272037,zpsVUPQXeq9iyfEiPf0PHw,4hmmTmWdC2d7kXhCmWZ8kg,8CNEh7fSbLwDuAKhLjDPKQ,2,-0.066666667,and in one case (the active display on the floor that you interact with) the whole thing was in spanish with no way that i could tell to flip it to english to figure out what the game / point was of the display
272038,zpsVUPQXeq9iyfEiPf0PHw,4hmmTmWdC2d7kXhCmWZ8kg,8CNEh7fSbLwDuAKhLjDPKQ,2,-0.5,"fail, wtf? useless"
272039,zpsVUPQXeq9iyfEiPf0PHw,4hmmTmWdC2d7kXhCmWZ8kg,8CNEh7fSbLwDuAKhLjDPKQ,2,0,after that you're dumped into the gift store
272040,zpsVUPQXeq9iyfEiPf0PHw,4hmmTmWdC2d7kXhCmWZ8kg,8CNEh7fSbLwDuAKhLjDPKQ,2,0.6,honestly i didn't even take the time to look at anything
272041,zpsVUPQXeq9iyfEiPf0PHw,4hmmTmWdC2d7kXhCmWZ8kg,8CNEh7fSbLwDuAKhLjDPKQ,2,0.3,more screaming kids and strollers blocking routes and i was ready to get outta dodge as fast as i could
272042,zpsVUPQXeq9iyfEiPf0PHw,4hmmTmWdC2d7kXhCmWZ8kg,8CNEh7fSbLwDuAKhLjDPKQ,2,0,after the store is a kids play area - something with the big plastic tubes and stuff like you see at burger kings
272043,zpsVUPQXeq9iyfEiPf0PHw,4hmmTmWdC2d7kXhCmWZ8kg,8CNEh7fSbLwDuAKhLjDPKQ,2,0,aahhh get me out of here! reminded me of a playground or school recess area
272044,zpsVUPQXeq9iyfEiPf0PHw,4hmmTmWdC2d7kXhCmWZ8kg,8CNEh7fSbLwDuAKhLjDPKQ,2,0,"so, needless to say i went in expecting more and left feeling shorted and unimpressed"
272045,zpsVUPQXeq9iyfEiPf0PHw,4hmmTmWdC2d7kXhCmWZ8kg,8CNEh7fSbLwDuAKhLjDPKQ,2,0,won't be back
272046,jgayXY8CdwpVn4YyENhh6Q,4hmmTmWdC2d7kXhCmWZ8kg,RxfFQxUtSIGYwTKU_rvAeg,3,0,we came here last sunday using $5 off per admission coupon from the entertainment book
272047,jgayXY8CdwpVn4YyENhh6Q,4hmmTmWdC2d7kXhCmWZ8kg,RxfFQxUtSIGYwTKU_rvAeg,3,0,"after the discount, two adults and a child came out to $35"
272048,jgayXY8CdwpVn4YyENhh6Q,4hmmTmWdC2d7kXhCmWZ8kg,RxfFQxUtSIGYwTKU_rvAeg,3,0.5,"aside from the sticker shock, i was moderately pleased with the aquarium"
272049,jgayXY8CdwpVn4YyENhh6Q,4hmmTmWdC2d7kXhCmWZ8kg,RxfFQxUtSIGYwTKU_rvAeg,3,0,"it seemed like for a while, we kept seeing the same fish exhibits but as you get closer to the end, it gets cooler"
272050,jgayXY8CdwpVn4YyENhh6Q,4hmmTmWdC2d7kXhCmWZ8kg,RxfFQxUtSIGYwTKU_rvAeg,3,0.433333333,"i was very entertained by the stingray/small shark tank and i loved the huge area with all of the fish, stingrays, and sharks swimming around"
272051,jgayXY8CdwpVn4YyENhh6Q,4hmmTmWdC2d7kXhCmWZ8kg,RxfFQxUtSIGYwTKU_rvAeg,3,0,"there was a tunnel you could walk through with see-through glass below, to the sides and above you"
272052,jgayXY8CdwpVn4YyENhh6Q,4hmmTmWdC2d7kXhCmWZ8kg,RxfFQxUtSIGYwTKU_rvAeg,3,0,another thing i thought was neat were the couple of tanks that you could crawl under and pop your head in the middle
272053,jgayXY8CdwpVn4YyENhh6Q,4hmmTmWdC2d7kXhCmWZ8kg,RxfFQxUtSIGYwTKU_rvAeg,3,-0.05,we freaked out my 3 years old a few times with that
272054,jgayXY8CdwpVn4YyENhh6Q,4hmmTmWdC2d7kXhCmWZ8kg,RxfFQxUtSIGYwTKU_rvAeg,3,0.3,pretty cool
272055,jgayXY8CdwpVn4YyENhh6Q,4hmmTmWdC2d7kXhCmWZ8kg,RxfFQxUtSIGYwTKU_rvAeg,3,-0.0125,the aquarium was small but i didn't expect much for a mall? i do think it is too expensive with/without a coupon but i'm sure something like this costs alot to maintain
272056,jgayXY8CdwpVn4YyENhh6Q,4hmmTmWdC2d7kXhCmWZ8kg,RxfFQxUtSIGYwTKU_rvAeg,3,-0.05,i'm not sure i would come back because of the costs but i definitely think it worth going at least once
272057,qnuuWkod1XjiUW6m6ZnP2A,4hmmTmWdC2d7kXhCmWZ8kg,IP_80RkCFvrzVuONT3TOqg,4,0.5,"i love the ocean, i love scuba diving, i love fish"
272058,qnuuWkod1XjiUW6m6ZnP2A,4hmmTmWdC2d7kXhCmWZ8kg,IP_80RkCFvrzVuONT3TOqg,4,0.136363636,but i live in the desert
272059,qnuuWkod1XjiUW6m6ZnP2A,4hmmTmWdC2d7kXhCmWZ8kg,IP_80RkCFvrzVuONT3TOqg,4,0.383984375,"so of course, i was beyond excited to hear that an aquarium was opening up in town!  the $18 ticket price kept me away until yesterday, when i scored a groupon for $9 per ticket!  i'm glad i waited, because i don't feel as though it's worth the normal price"
272060,qnuuWkod1XjiUW6m6ZnP2A,4hmmTmWdC2d7kXhCmWZ8kg,IP_80RkCFvrzVuONT3TOqg,4,0.316666667,"overall, it's a pretty good aquarium"
272061,qnuuWkod1XjiUW6m6ZnP2A,4hmmTmWdC2d7kXhCmWZ8kg,IP_80RkCFvrzVuONT3TOqg,4,0.238095238,"i've definitely seen better, but those have been in large cities or close to the ocean"
272062,qnuuWkod1XjiUW6m6ZnP2A,4hmmTmWdC2d7kXhCmWZ8kg,IP_80RkCFvrzVuONT3TOqg,4,0.3375,"it's very small (located inside a mall), but they did the best they could with the space they had"
272063,qnuuWkod1XjiUW6m6ZnP2A,4hmmTmWdC2d7kXhCmWZ8kg,IP_80RkCFvrzVuONT3TOqg,4,-0.028571429,"there is one large tank, which you can view from at least four different locations"
272064,qnuuWkod1XjiUW6m6ZnP2A,4hmmTmWdC2d7kXhCmWZ8kg,IP_80RkCFvrzVuONT3TOqg,4,0.05,"i'm not a big fan of the ""line"" you have to stand in pretty much through the entire thing, since the path is fairly narrow, and winds around from area to area"
272065,qnuuWkod1XjiUW6m6ZnP2A,4hmmTmWdC2d7kXhCmWZ8kg,IP_80RkCFvrzVuONT3TOqg,4,0.4375,"but overall, there was a good variety of animals, and lots of facts and information to make it a great educational experience"
272066,qnuuWkod1XjiUW6m6ZnP2A,4hmmTmWdC2d7kXhCmWZ8kg,IP_80RkCFvrzVuONT3TOqg,4,0.238333333,"the decor reminds me of disneyland - very clean, and lots of attention to detail, which i definitely appreciate"
272067,qnuuWkod1XjiUW6m6ZnP2A,4hmmTmWdC2d7kXhCmWZ8kg,IP_80RkCFvrzVuONT3TOqg,4,0.15625,"one of my favorite things was the little scratch-off ""quiz card"" that you get when you enter"
272068,qnuuWkod1XjiUW6m6ZnP2A,4hmmTmWdC2d7kXhCmWZ8kg,IP_80RkCFvrzVuONT3TOqg,4,0,"there are eight questions to answer, and it helps keep younger kids entertained while waiting for the line to move along"
272069,qnuuWkod1XjiUW6m6ZnP2A,4hmmTmWdC2d7kXhCmWZ8kg,IP_80RkCFvrzVuONT3TOqg,4,0,"at the end, they can redeem their card for a sticker at the gift shop"
272070,qnuuWkod1XjiUW6m6ZnP2A,4hmmTmWdC2d7kXhCmWZ8kg,IP_80RkCFvrzVuONT3TOqg,4,0.15,"this is a great way to avoid buying overpriced, unnecessary souvenirs!"
272071,qnuuWkod1XjiUW6m6ZnP2A,4hmmTmWdC2d7kXhCmWZ8kg,IP_80RkCFvrzVuONT3TOqg,4,-0.133333333,"we spent about an hour and a half walking through the aquarium, stopping at each exhibit"
272072,qnuuWkod1XjiUW6m6ZnP2A,4hmmTmWdC2d7kXhCmWZ8kg,IP_80RkCFvrzVuONT3TOqg,4,0,"some of our favorites were the tidepool creatures (touch tank), sharks and rays (viewable from above the tank as well as the side), and seahorses"
272073,qnuuWkod1XjiUW6m6ZnP2A,4hmmTmWdC2d7kXhCmWZ8kg,IP_80RkCFvrzVuONT3TOqg,4,0.284375,"they also had a very cool octopus!  the aquarium has ""talks"" scheduled for every hour or so in different areas, and if we had decided to stay for one or two of those, we probably would have been there for longer"
272074,qnuuWkod1XjiUW6m6ZnP2A,4hmmTmWdC2d7kXhCmWZ8kg,IP_80RkCFvrzVuONT3TOqg,4,0.214285714,"at the end of the aquarium, there is a large room with a play structure"
272075,qnuuWkod1XjiUW6m6ZnP2A,4hmmTmWdC2d7kXhCmWZ8kg,IP_80RkCFvrzVuONT3TOqg,4,0.2109375,"i'm not sure why they need this, although our little guy sure enjoyed it!  i wish they had used that space for another exhibit!"
272076,qnuuWkod1XjiUW6m6ZnP2A,4hmmTmWdC2d7kXhCmWZ8kg,IP_80RkCFvrzVuONT3TOqg,4,0.3,"it was a fun experience, and worth the $9 discounted tickets"
272077,qnuuWkod1XjiUW6m6ZnP2A,4hmmTmWdC2d7kXhCmWZ8kg,IP_80RkCFvrzVuONT3TOqg,4,0.1,i'd really like to check out the aquarium at wildlife world zoo next
272078,x_890zsTX6WUfIdxFw6RKg,4hmmTmWdC2d7kXhCmWZ8kg,0beZngJ03EmIQfVcnlVK4w,2,-0.213125,i was sooooo disappointed with the aquarium:( i had really high hopes and was very excited to go and it was just blah
272079,x_890zsTX6WUfIdxFw6RKg,4hmmTmWdC2d7kXhCmWZ8kg,0beZngJ03EmIQfVcnlVK4w,2,0.2,i don't think i would call it an aquarium as much as it is some fish in smallish takes swimming around in circles
272080,x_890zsTX6WUfIdxFw6RKg,4hmmTmWdC2d7kXhCmWZ8kg,0beZngJ03EmIQfVcnlVK4w,2,0,the kids seemed to like it but it doesn't hold a candle to the monterrey aquarium
272081,x_890zsTX6WUfIdxFw6RKg,4hmmTmWdC2d7kXhCmWZ8kg,0beZngJ03EmIQfVcnlVK4w,2,0.083333333,"it seemed to be some-what educational and the animals seemed healthy, but almost all the plant-life and corral were fake"
272082,x_890zsTX6WUfIdxFw6RKg,4hmmTmWdC2d7kXhCmWZ8kg,0beZngJ03EmIQfVcnlVK4w,2,0.6,in fact the tanks of fish they have at cabala's are much more fascinating
272083,x_890zsTX6WUfIdxFw6RKg,4hmmTmWdC2d7kXhCmWZ8kg,0beZngJ03EmIQfVcnlVK4w,2,0,"anyway, my advise to you is to save your $$"
272084,x_890zsTX6WUfIdxFw6RKg,4hmmTmWdC2d7kXhCmWZ8kg,0beZngJ03EmIQfVcnlVK4w,2,-0.15,it is not worth the price at all
272085,x_890zsTX6WUfIdxFw6RKg,4hmmTmWdC2d7kXhCmWZ8kg,0beZngJ03EmIQfVcnlVK4w,2,0.5,i hope the az zoo is better
272086,1Ltsyg824p0Tir2ZnKRSiw,4hmmTmWdC2d7kXhCmWZ8kg,Q6FaSZpCtVv7PXECwDL1bg,4,0.05,today i used a groupon i had purchased a few months ago and felt my aquarium experience was well worth the discounted $9 entrance fee
272087,1Ltsyg824p0Tir2ZnKRSiw,4hmmTmWdC2d7kXhCmWZ8kg,Q6FaSZpCtVv7PXECwDL1bg,4,-0.166666667,i didn't have to wait in any lines to get in and there weren't any lines to go through the museum as mentioned in previous reviews
272088,1Ltsyg824p0Tir2ZnKRSiw,4hmmTmWdC2d7kXhCmWZ8kg,Q6FaSZpCtVv7PXECwDL1bg,4,0.25,"you can have your picture taken as you enter and pick it up at the end in a creative souvenier frame, for an extra fee, of course"
272089,1Ltsyg824p0Tir2ZnKRSiw,4hmmTmWdC2d7kXhCmWZ8kg,Q6FaSZpCtVv7PXECwDL1bg,4,0,the photographer asks you to point or look up
272090,1Ltsyg824p0Tir2ZnKRSiw,4hmmTmWdC2d7kXhCmWZ8kg,Q6FaSZpCtVv7PXECwDL1bg,4,0.5,those pictures turned out really cute with the jellyfish and sea life backgrounds
272091,1Ltsyg824p0Tir2ZnKRSiw,4hmmTmWdC2d7kXhCmWZ8kg,Q6FaSZpCtVv7PXECwDL1bg,4,0,"i took my time going through the aquarium, reading everything (recommendation:the print should be lower to the ground and bigger to make it easire to read, especialy for kids) and taking tons of pictures with my mobile phone"
272092,1Ltsyg824p0Tir2ZnKRSiw,4hmmTmWdC2d7kXhCmWZ8kg,Q6FaSZpCtVv7PXECwDL1bg,4,0,(i posted some of them)
272093,1Ltsyg824p0Tir2ZnKRSiw,4hmmTmWdC2d7kXhCmWZ8kg,Q6FaSZpCtVv7PXECwDL1bg,4,0.166666667,i was lucky enough to be there during the seahorse feeding
272094,1Ltsyg824p0Tir2ZnKRSiw,4hmmTmWdC2d7kXhCmWZ8kg,Q6FaSZpCtVv7PXECwDL1bg,4,0.341666667,they're sooo cute!  there's even a rare natural albino seahorse in one of the tanks
272095,1Ltsyg824p0Tir2ZnKRSiw,4hmmTmWdC2d7kXhCmWZ8kg,Q6FaSZpCtVv7PXECwDL1bg,4,0.5,"in all my years of scuba diving, i have never seen more than one seahorse at a time"
272096,1Ltsyg824p0Tir2ZnKRSiw,4hmmTmWdC2d7kXhCmWZ8kg,Q6FaSZpCtVv7PXECwDL1bg,4,0.357142857,this was a special treat
272097,1Ltsyg824p0Tir2ZnKRSiw,4hmmTmWdC2d7kXhCmWZ8kg,Q6FaSZpCtVv7PXECwDL1bg,4,0.107142857,"you'll see lots of fish, sharks, various rays, starfish, jellyfish and even a large pacific octopus"
