,review_id,business_id,user_id,stars,blob_polarity,review
273343,6SSlgVNSynwm9dQGKDDVyA,aGtU_Wkp_lOCs9VQTXC6sw,OreImiVjeEgo3LDTvCKS9A,1,-0.05,"if you have no choice to go anywhere else, expect waiting for a long time"
273344,WYll-qZKRuMJzKeXt0mnBg,aGtU_Wkp_lOCs9VQTXC6sw,N7wNlo3_EaHUWHiFDyGh5g,3,-0.15,"i feel like the usps is one of those places that people love to hate, like the dmv"
273345,WYll-qZKRuMJzKeXt0mnBg,aGtU_Wkp_lOCs9VQTXC6sw,N7wNlo3_EaHUWHiFDyGh5g,3,-0.05,a big part of that has to do with the fact that we have no choice but to enlist in their services and they're not very customer-centric
273346,WYll-qZKRuMJzKeXt0mnBg,aGtU_Wkp_lOCs9VQTXC6sw,N7wNlo3_EaHUWHiFDyGh5g,3,0.1875,"however, i don't share these feelings of hatred because my expectations are rather low and thus, never disappointed"
273347,WYll-qZKRuMJzKeXt0mnBg,aGtU_Wkp_lOCs9VQTXC6sw,N7wNlo3_EaHUWHiFDyGh5g,3,0.1,"since i sell items online, i need to visit a usps office frequently"
273348,WYll-qZKRuMJzKeXt0mnBg,aGtU_Wkp_lOCs9VQTXC6sw,N7wNlo3_EaHUWHiFDyGh5g,3,0.416666667,every experience has been fine
273349,WYll-qZKRuMJzKeXt0mnBg,aGtU_Wkp_lOCs9VQTXC6sw,N7wNlo3_EaHUWHiFDyGh5g,3,0.148333333,"although this location is very busy and i have always encountered a line, it moves decently"
273350,WYll-qZKRuMJzKeXt0mnBg,aGtU_Wkp_lOCs9VQTXC6sw,N7wNlo3_EaHUWHiFDyGh5g,3,0.45,"there's always an employee walking around the lobby, attempting to assist everyone with questions, appropriate packaging and labels, and ensuring everyone is prepared so the line moves smoothly"
273351,WYll-qZKRuMJzKeXt0mnBg,aGtU_Wkp_lOCs9VQTXC6sw,N7wNlo3_EaHUWHiFDyGh5g,3,0.5,"i appreciate this effort, but there are too many customers for just one person to handle"
273352,WYll-qZKRuMJzKeXt0mnBg,aGtU_Wkp_lOCs9VQTXC6sw,N7wNlo3_EaHUWHiFDyGh5g,3,0,"therefore, several individuals will arrive at the counter with incorrect supplies or simply unprepared"
273353,WYll-qZKRuMJzKeXt0mnBg,aGtU_Wkp_lOCs9VQTXC6sw,N7wNlo3_EaHUWHiFDyGh5g,3,0.65,"that was me! i was more than happy to step aside and correct it, but the situation could've been avoided"
273354,WYll-qZKRuMJzKeXt0mnBg,aGtU_Wkp_lOCs9VQTXC6sw,N7wNlo3_EaHUWHiFDyGh5g,3,0.25,"the supplies (envelopes, boxes, labels, pens, tape) are not always readily available or properly marked"
273355,WYll-qZKRuMJzKeXt0mnBg,aGtU_Wkp_lOCs9VQTXC6sw,N7wNlo3_EaHUWHiFDyGh5g,3,-0.25,"people use the wrong packaging and labels which hold up the counter, there are never any pens to use to fill out labels, and the packaging tape is only for priority shipping (how would you know without being told?)"
273356,WYll-qZKRuMJzKeXt0mnBg,aGtU_Wkp_lOCs9VQTXC6sw,N7wNlo3_EaHUWHiFDyGh5g,3,0,it's simply not organized
273357,WYll-qZKRuMJzKeXt0mnBg,aGtU_Wkp_lOCs9VQTXC6sw,N7wNlo3_EaHUWHiFDyGh5g,3,0.225,"there are different labels located at different sections of the store, you don't even know what most of them do, and no one is available to help you with any of these questions"
273358,WYll-qZKRuMJzKeXt0mnBg,aGtU_Wkp_lOCs9VQTXC6sw,N7wNlo3_EaHUWHiFDyGh5g,3,0.155,"of course, i love the complimentary envelopes and boxes for priority and priority flat rate (make sure you don't use the wrong one though)"
273359,WYll-qZKRuMJzKeXt0mnBg,aGtU_Wkp_lOCs9VQTXC6sw,N7wNlo3_EaHUWHiFDyGh5g,3,0.325,"priority flat rate shipping is really popular, so those supplies are always available"
273360,WYll-qZKRuMJzKeXt0mnBg,aGtU_Wkp_lOCs9VQTXC6sw,N7wNlo3_EaHUWHiFDyGh5g,3,-0.017857143,"the envelopes and boxes come in small, medium, and large"
273361,WYll-qZKRuMJzKeXt0mnBg,aGtU_Wkp_lOCs9VQTXC6sw,N7wNlo3_EaHUWHiFDyGh5g,3,0,"if you request it, usps will even drop off these materials to your home! including a pick up"
273362,WYll-qZKRuMJzKeXt0mnBg,aGtU_Wkp_lOCs9VQTXC6sw,N7wNlo3_EaHUWHiFDyGh5g,3,0.716666667,"i wish i could say everyone was pleasant or helpful, but i haven't had a good experience in this department"
273363,WYll-qZKRuMJzKeXt0mnBg,aGtU_Wkp_lOCs9VQTXC6sw,N7wNlo3_EaHUWHiFDyGh5g,3,-0.025,i'm not surprised nor upset though - i can't imagine i'd have an ounce of patience left if i had to work at a usps counter
273364,WYll-qZKRuMJzKeXt0mnBg,aGtU_Wkp_lOCs9VQTXC6sw,N7wNlo3_EaHUWHiFDyGh5g,3,-0.625,the customers are even worse!!
273365,WYll-qZKRuMJzKeXt0mnBg,aGtU_Wkp_lOCs9VQTXC6sw,N7wNlo3_EaHUWHiFDyGh5g,3,0,"so, if you want to avoid the lines, check out the dimensions of the packaging supplies and request a drop off and pick up"
273366,WYll-qZKRuMJzKeXt0mnBg,aGtU_Wkp_lOCs9VQTXC6sw,N7wNlo3_EaHUWHiFDyGh5g,3,0.8,or brave the location once to pick up some envelopes and boxes and request pick ups at home just by printing your label from their website
273367,WYll-qZKRuMJzKeXt0mnBg,aGtU_Wkp_lOCs9VQTXC6sw,N7wNlo3_EaHUWHiFDyGh5g,3,-0.208333333,"the prices are slightly cheaper when you utilize the website as well! if you don't want to do a home pick up, you can still print the label at home and visit a usps location to utilize their envelope/box and drop it off there - then you still avoid the lines"
273368,WYll-qZKRuMJzKeXt0mnBg,aGtU_Wkp_lOCs9VQTXC6sw,N7wNlo3_EaHUWHiFDyGh5g,3,0.197619048,"if you absolutely must visit a usps location, here's my advice: bring a pen and/or permanent marker, packaging tape (for boxes), and before you wait in line, ensure that you have the appropriate supplies (if you're not certain, ask someone)"
273369,WYll-qZKRuMJzKeXt0mnBg,aGtU_Wkp_lOCs9VQTXC6sw,N7wNlo3_EaHUWHiFDyGh5g,3,0,"also, expect a wait and plan your schedule around your visit"
273370,W89NpkPAws9hsLrfJZ0p9w,aGtU_Wkp_lOCs9VQTXC6sw,XUuugPgaTWn3_zreYjK2Dg,3,0,came here looking for passport service
273371,W89NpkPAws9hsLrfJZ0p9w,aGtU_Wkp_lOCs9VQTXC6sw,XUuugPgaTWn3_zreYjK2Dg,3,0,this location does not do passport service
273372,W89NpkPAws9hsLrfJZ0p9w,aGtU_Wkp_lOCs9VQTXC6sw,XUuugPgaTWn3_zreYjK2Dg,3,0.1,they do have a list of branches around the valley that does (jones near flamingo or rainbow near spring mountain are the two close ones that do have passport service)
273373,W89NpkPAws9hsLrfJZ0p9w,aGtU_Wkp_lOCs9VQTXC6sw,XUuugPgaTWn3_zreYjK2Dg,3,-0.1875,"came here on a tuesday afternoon, a little before 1"
273374,W89NpkPAws9hsLrfJZ0p9w,aGtU_Wkp_lOCs9VQTXC6sw,XUuugPgaTWn3_zreYjK2Dg,3,0.25,pretty packed
273375,W89NpkPAws9hsLrfJZ0p9w,aGtU_Wkp_lOCs9VQTXC6sw,XUuugPgaTWn3_zreYjK2Dg,3,0,lots of people
273376,W89NpkPAws9hsLrfJZ0p9w,aGtU_Wkp_lOCs9VQTXC6sw,XUuugPgaTWn3_zreYjK2Dg,3,0.0625,i believe they had 2-3 different lanes open at the same time but still pretty backed up
273377,W89NpkPAws9hsLrfJZ0p9w,aGtU_Wkp_lOCs9VQTXC6sw,XUuugPgaTWn3_zreYjK2Dg,3,0,only one entrance/exit for the branch
273378,W89NpkPAws9hsLrfJZ0p9w,aGtU_Wkp_lOCs9VQTXC6sw,XUuugPgaTWn3_zreYjK2Dg,3,0,i accidentally missed the entrance and turned into the street east of the location to do a u-turn
273379,W89NpkPAws9hsLrfJZ0p9w,aGtU_Wkp_lOCs9VQTXC6sw,XUuugPgaTWn3_zreYjK2Dg,3,0,oops? 
273380,W89NpkPAws9hsLrfJZ0p9w,aGtU_Wkp_lOCs9VQTXC6sw,XUuugPgaTWn3_zreYjK2Dg,3,0.418181818,branch good for those who live in the sw side for their mailing purposes
273381,W89NpkPAws9hsLrfJZ0p9w,aGtU_Wkp_lOCs9VQTXC6sw,XUuugPgaTWn3_zreYjK2Dg,3,0.208333333,has a decent amount of po boxes too !
273382,mTOIPnxVVhv2E_3AJBu2Aw,aGtU_Wkp_lOCs9VQTXC6sw,5sG8OsOFbB1uoHWI7LKEVA,1,-0.05,"holy hell, the employees are arguing with eachother at the front when there is a long line, i've been here for about an hour waiting for them to find my package"
273383,mTOIPnxVVhv2E_3AJBu2Aw,aGtU_Wkp_lOCs9VQTXC6sw,5sG8OsOFbB1uoHWI7LKEVA,1,-0.4,this place is worse than the dmv
273384,mTOIPnxVVhv2E_3AJBu2Aw,aGtU_Wkp_lOCs9VQTXC6sw,5sG8OsOFbB1uoHWI7LKEVA,1,0.5,i wish they had better leadership
273385,mTOIPnxVVhv2E_3AJBu2Aw,aGtU_Wkp_lOCs9VQTXC6sw,5sG8OsOFbB1uoHWI7LKEVA,1,0,the people who work here have no idea what they are doing
273386,AGfIsWhWz6SgPf9P1_FIdw,aGtU_Wkp_lOCs9VQTXC6sw,A77Yq9wvaDwGceg7UI8NVg,2,0.6,nice people but the working like a robot
273387,AGfIsWhWz6SgPf9P1_FIdw,aGtU_Wkp_lOCs9VQTXC6sw,A77Yq9wvaDwGceg7UI8NVg,2,-0.1,fake smile
273388,AGfIsWhWz6SgPf9P1_FIdw,aGtU_Wkp_lOCs9VQTXC6sw,A77Yq9wvaDwGceg7UI8NVg,2,0,15 min line
273389,AGfIsWhWz6SgPf9P1_FIdw,aGtU_Wkp_lOCs9VQTXC6sw,A77Yq9wvaDwGceg7UI8NVg,2,-0.2,missing product / boxes
273390,AGfIsWhWz6SgPf9P1_FIdw,aGtU_Wkp_lOCs9VQTXC6sw,A77Yq9wvaDwGceg7UI8NVg,2,0,beware from the russia employee
273391,F3secZnk-NNhJvkKskmNQw,aGtU_Wkp_lOCs9VQTXC6sw,CeLJ-YWleUBZ8q-HDwmm_g,1,-0.202353896,not only is this place extremely packed from the moment it opens to the moment it closes but the employees are by far rude! unethical! retarded! old! slow! incompetents and just plain useless! specially the tall dude with the facial hair that looks like a child molestor!
273392,7hVaOYeJAXmR25oV1MeXkQ,aGtU_Wkp_lOCs9VQTXC6sw,PJPC3u0HV3Yc1zyF8D3f_A,1,-0.1,"worst post office in the valley! i have lived in vegas my whole life, and i have never had to wait more than 15 minutes to retrieve a package"
273393,7hVaOYeJAXmR25oV1MeXkQ,aGtU_Wkp_lOCs9VQTXC6sw,PJPC3u0HV3Yc1zyF8D3f_A,1,-0.2125,"at this office be prepared to wait at least 45 minutes! i have also tried to have packages redelivered to my home to avoid the long wait lines, but they won't"
273394,7hVaOYeJAXmR25oV1MeXkQ,aGtU_Wkp_lOCs9VQTXC6sw,PJPC3u0HV3Yc1zyF8D3f_A,1,0.3125,when i purchase my next home i will make sure it is not zoned for this post office!
273395,uuxHGaHw41B3OvXxqfR6yw,aGtU_Wkp_lOCs9VQTXC6sw,bJhS1e5V2YZS-lzzgtLiNQ,1,0.2,i've never written a review so damn fast
273396,uuxHGaHw41B3OvXxqfR6yw,aGtU_Wkp_lOCs9VQTXC6sw,bJhS1e5V2YZS-lzzgtLiNQ,1,0.25,first off the post office is the post office
273397,uuxHGaHw41B3OvXxqfR6yw,aGtU_Wkp_lOCs9VQTXC6sw,bJhS1e5V2YZS-lzzgtLiNQ,1,0.2,it's going to suck a whole lot of the time
273398,uuxHGaHw41B3OvXxqfR6yw,aGtU_Wkp_lOCs9VQTXC6sw,bJhS1e5V2YZS-lzzgtLiNQ,1,0,i get it
273399,uuxHGaHw41B3OvXxqfR6yw,aGtU_Wkp_lOCs9VQTXC6sw,bJhS1e5V2YZS-lzzgtLiNQ,1,0.1,aside from this place from having that old beat up interior decor
273400,uuxHGaHw41B3OvXxqfR6yw,aGtU_Wkp_lOCs9VQTXC6sw,bJhS1e5V2YZS-lzzgtLiNQ,1,0,here's what happens just now:
273401,uuxHGaHw41B3OvXxqfR6yw,aGtU_Wkp_lOCs9VQTXC6sw,bJhS1e5V2YZS-lzzgtLiNQ,1,0,husband and i went in to send a return package to cox
273402,uuxHGaHw41B3OvXxqfR6yw,aGtU_Wkp_lOCs9VQTXC6sw,bJhS1e5V2YZS-lzzgtLiNQ,1,0.2,the box was ready to go with the exception of tape
273403,uuxHGaHw41B3OvXxqfR6yw,aGtU_Wkp_lOCs9VQTXC6sw,bJhS1e5V2YZS-lzzgtLiNQ,1,0.075,"idk who this ""customer service attendant"" is that runs the floor while you're waiting in that long "
273404,uuxHGaHw41B3OvXxqfR6yw,aGtU_Wkp_lOCs9VQTXC6sw,bJhS1e5V2YZS-lzzgtLiNQ,1,0,@$$ line but she approached us and lectured us on the collapsible box package
273405,uuxHGaHw41B3OvXxqfR6yw,aGtU_Wkp_lOCs9VQTXC6sw,bJhS1e5V2YZS-lzzgtLiNQ,1,0,"she said with a snicker, ""you can't send it like that you have to tape"
273406,uuxHGaHw41B3OvXxqfR6yw,aGtU_Wkp_lOCs9VQTXC6sw,bJhS1e5V2YZS-lzzgtLiNQ,1,0.416666667,""" the first time my husband said, ""oh ok, it's ok i'll get the tape"
273407,uuxHGaHw41B3OvXxqfR6yw,aGtU_Wkp_lOCs9VQTXC6sw,bJhS1e5V2YZS-lzzgtLiNQ,1,0.152777778,"""  but forcefully repeated it 6 times! as if she was pissed off and lecturing her 9 year old kid! wtf?!? i interjected before my husband blew his top and said, ""ok that's fine lady we'll know next time"
273408,uuxHGaHw41B3OvXxqfR6yw,aGtU_Wkp_lOCs9VQTXC6sw,bJhS1e5V2YZS-lzzgtLiNQ,1,0,i want to leave now! i'm not going to be disrespected for no damn reason
273409,uuxHGaHw41B3OvXxqfR6yw,aGtU_Wkp_lOCs9VQTXC6sw,bJhS1e5V2YZS-lzzgtLiNQ,1,-0.316666667,she is fuking ridiculous rude
273410,uuxHGaHw41B3OvXxqfR6yw,aGtU_Wkp_lOCs9VQTXC6sw,bJhS1e5V2YZS-lzzgtLiNQ,1,0,""" "
273411,uuxHGaHw41B3OvXxqfR6yw,aGtU_Wkp_lOCs9VQTXC6sw,bJhS1e5V2YZS-lzzgtLiNQ,1,0,so ummm maybe regulations have changed and you have to wrap your packages before you approach the counter
273412,uuxHGaHw41B3OvXxqfR6yw,aGtU_Wkp_lOCs9VQTXC6sw,bJhS1e5V2YZS-lzzgtLiNQ,1,0,lady
273413,uuxHGaHw41B3OvXxqfR6yw,aGtU_Wkp_lOCs9VQTXC6sw,bJhS1e5V2YZS-lzzgtLiNQ,1,0,whoever you are
273414,uuxHGaHw41B3OvXxqfR6yw,aGtU_Wkp_lOCs9VQTXC6sw,bJhS1e5V2YZS-lzzgtLiNQ,1,0.5,"learn the correct way to approach someone! you're better off saying, ""oh, you just need to wrap it with tape before we send it off"
273415,uuxHGaHw41B3OvXxqfR6yw,aGtU_Wkp_lOCs9VQTXC6sw,bJhS1e5V2YZS-lzzgtLiNQ,1,0,""" and left it at that!"
273416,uuxHGaHw41B3OvXxqfR6yw,aGtU_Wkp_lOCs9VQTXC6sw,bJhS1e5V2YZS-lzzgtLiNQ,1,0,my husband and i are grown @$$ people
273417,uuxHGaHw41B3OvXxqfR6yw,aGtU_Wkp_lOCs9VQTXC6sw,bJhS1e5V2YZS-lzzgtLiNQ,1,0,we will buy some fuking tape here and wrap that bith up no fuking problem!!!
273418,uuxHGaHw41B3OvXxqfR6yw,aGtU_Wkp_lOCs9VQTXC6sw,bJhS1e5V2YZS-lzzgtLiNQ,1,0,i don't need anyone lecturing me on how to package
273419,uuxHGaHw41B3OvXxqfR6yw,aGtU_Wkp_lOCs9VQTXC6sw,bJhS1e5V2YZS-lzzgtLiNQ,1,-0.125,apparently you all do not inspect your packages like you used to (at least they do in san diego)
273420,uuxHGaHw41B3OvXxqfR6yw,aGtU_Wkp_lOCs9VQTXC6sw,bJhS1e5V2YZS-lzzgtLiNQ,1,0,so usps security must be $hit since all those budget cuts
273421,uuxHGaHw41B3OvXxqfR6yw,aGtU_Wkp_lOCs9VQTXC6sw,bJhS1e5V2YZS-lzzgtLiNQ,1,0,hmm
273422,uuxHGaHw41B3OvXxqfR6yw,aGtU_Wkp_lOCs9VQTXC6sw,bJhS1e5V2YZS-lzzgtLiNQ,1,0,beware consumers!
273423,uuxHGaHw41B3OvXxqfR6yw,aGtU_Wkp_lOCs9VQTXC6sw,bJhS1e5V2YZS-lzzgtLiNQ,1,-0.072222222,usps apparently hire people who lack common sense and social interpersonal skills
273424,uuxHGaHw41B3OvXxqfR6yw,aGtU_Wkp_lOCs9VQTXC6sw,bJhS1e5V2YZS-lzzgtLiNQ,1,-0.071428571,idgaf if i'm sending one single chicklet
273425,uuxHGaHw41B3OvXxqfR6yw,aGtU_Wkp_lOCs9VQTXC6sw,bJhS1e5V2YZS-lzzgtLiNQ,1,0,i'd rather deal with ups
273426,zA05iXl_VzLfXVhTAITR-g,aGtU_Wkp_lOCs9VQTXC6sw,ZBI7dxznrqkdYy_wvE2fgQ,1,-1,this place has the worst service inside! the pick up time for the drive thru drop off is 3pm
273427,zA05iXl_VzLfXVhTAITR-g,aGtU_Wkp_lOCs9VQTXC6sw,ZBI7dxznrqkdYy_wvE2fgQ,1,0,"who drops off mail at 3? if the place were truly accommodating, it would have a later last drop off time"
273428,zA05iXl_VzLfXVhTAITR-g,aGtU_Wkp_lOCs9VQTXC6sw,ZBI7dxznrqkdYy_wvE2fgQ,1,-0.375,the people inside are just rude! they are not helpful when it comes to packages
273429,zA05iXl_VzLfXVhTAITR-g,aGtU_Wkp_lOCs9VQTXC6sw,ZBI7dxznrqkdYy_wvE2fgQ,1,0.1,fyi bring your own tape because the people behind the corner will not give you any
273430,YFpSHyD0BMxwacULf6jlSQ,aGtU_Wkp_lOCs9VQTXC6sw,rnTjdwW2MYMz0Z9-lVjmEg,1,0,do not purchase usps insurance
273431,YFpSHyD0BMxwacULf6jlSQ,aGtU_Wkp_lOCs9VQTXC6sw,rnTjdwW2MYMz0Z9-lVjmEg,1,0,i purchased $179 of insurance on a $700 lladro figurine that i was shipping to a buyer
273432,YFpSHyD0BMxwacULf6jlSQ,aGtU_Wkp_lOCs9VQTXC6sw,rnTjdwW2MYMz0Z9-lVjmEg,1,0.2,i sold the item cheap so i only asked for the cost that i was paid for the item in insurance
273433,YFpSHyD0BMxwacULf6jlSQ,aGtU_Wkp_lOCs9VQTXC6sw,rnTjdwW2MYMz0Z9-lVjmEg,1,0,usps destroyed the item as it arrived in several pieces
273434,YFpSHyD0BMxwacULf6jlSQ,aGtU_Wkp_lOCs9VQTXC6sw,rnTjdwW2MYMz0Z9-lVjmEg,1,0,instead of receiving a check from usps for the total insured amount ($179) the usps decided that they only wanted to pay me $50 for the item they broke
273435,YFpSHyD0BMxwacULf6jlSQ,aGtU_Wkp_lOCs9VQTXC6sw,rnTjdwW2MYMz0Z9-lVjmEg,1,0.25,first they over charge for insurance and then they don't even pay you what you insure your packages for
273436,YFpSHyD0BMxwacULf6jlSQ,aGtU_Wkp_lOCs9VQTXC6sw,rnTjdwW2MYMz0Z9-lVjmEg,1,0,i will never ship with insurance through usps again! beware
273437,GOodxwSR68qmIt6Lhsro0g,aGtU_Wkp_lOCs9VQTXC6sw,tTzkE8CcbRoctGPZ9wKrJQ,1,-0.025,apparently you can place arbitrary charges on packages whenever you want
273438,GOodxwSR68qmIt6Lhsro0g,aGtU_Wkp_lOCs9VQTXC6sw,tTzkE8CcbRoctGPZ9wKrJQ,1,0,i came in 3 days apart to mail 3 certified letters to the credit bureaus
273439,GOodxwSR68qmIt6Lhsro0g,aGtU_Wkp_lOCs9VQTXC6sw,tTzkE8CcbRoctGPZ9wKrJQ,1,0,my charges were $3
273440,GOodxwSR68qmIt6Lhsro0g,aGtU_Wkp_lOCs9VQTXC6sw,tTzkE8CcbRoctGPZ9wKrJQ,1,0.25,"79 the first time, $3"
273441,GOodxwSR68qmIt6Lhsro0g,aGtU_Wkp_lOCs9VQTXC6sw,tTzkE8CcbRoctGPZ9wKrJQ,1,0,79 the second time and a whopping $5
273442,GOodxwSR68qmIt6Lhsro0g,aGtU_Wkp_lOCs9VQTXC6sw,tTzkE8CcbRoctGPZ9wKrJQ,1,0,62 the third time
273443,GOodxwSR68qmIt6Lhsro0g,aGtU_Wkp_lOCs9VQTXC6sw,tTzkE8CcbRoctGPZ9wKrJQ,1,0,same 3 pages in the same type of envelope and same 
273444,GOodxwSR68qmIt6Lhsro0g,aGtU_Wkp_lOCs9VQTXC6sw,tTzkE8CcbRoctGPZ9wKrJQ,1,0,60 oz letter
273445,GOodxwSR68qmIt6Lhsro0g,aGtU_Wkp_lOCs9VQTXC6sw,tTzkE8CcbRoctGPZ9wKrJQ,1,0,"the asian man who waited on me had to adjust my zip code by looking it up in the system since it was incorrect, so i guess he decided to charge me for his 'pain and suffering' in doing so"
273446,GOodxwSR68qmIt6Lhsro0g,aGtU_Wkp_lOCs9VQTXC6sw,tTzkE8CcbRoctGPZ9wKrJQ,1,-0.041666667,"when i asked him about the discrepancy in pricing since i had mailed this same 3 page letter two other times, he told me that this ""letter"" was actually a ""package"""
273447,GOodxwSR68qmIt6Lhsro0g,aGtU_Wkp_lOCs9VQTXC6sw,tTzkE8CcbRoctGPZ9wKrJQ,1,0.083333333,what????!!! a small envelope with three pages is a letter two times but magically becomes a package the third time you mail it
273448,GOodxwSR68qmIt6Lhsro0g,aGtU_Wkp_lOCs9VQTXC6sw,tTzkE8CcbRoctGPZ9wKrJQ,1,0,so aggravating! i need to find a different post office
273449,GOodxwSR68qmIt6Lhsro0g,aGtU_Wkp_lOCs9VQTXC6sw,tTzkE8CcbRoctGPZ9wKrJQ,1,0.666666667,"i am trying to talk to a supervisor by phone to get this straightened out, but it seems on top of of all of their wonderful customer service skills at this lovely post office, no one answers the phone here either"
273450,1JM1elnssQcJqwPNlgi8Zg,aGtU_Wkp_lOCs9VQTXC6sw,veE2w_aYZr2GvL21YYG6cw,1,-0.65,the worst service ever people don't do their job and wait time is over an hour and the people who work here are rude
273451,yKVcrphxEG2NNA47rDidvw,aGtU_Wkp_lOCs9VQTXC6sw,gittGGXtM4KDoK1KX7f6XA,1,0,if i could give them no stars i would
273452,yKVcrphxEG2NNA47rDidvw,aGtU_Wkp_lOCs9VQTXC6sw,gittGGXtM4KDoK1KX7f6XA,1,0,what a joke of a post office
273453,yKVcrphxEG2NNA47rDidvw,aGtU_Wkp_lOCs9VQTXC6sw,gittGGXtM4KDoK1KX7f6XA,1,0,i would vote to get rid of the postal service after going here
273454,yKVcrphxEG2NNA47rDidvw,aGtU_Wkp_lOCs9VQTXC6sw,gittGGXtM4KDoK1KX7f6XA,1,-0.062727273,if you are picking up mail or getting a new mail box key be prepared to wait an hour in line because while thy have 5 people working behind the counter only one helps the extremely long line of customers waiting for their mail
273455,yKVcrphxEG2NNA47rDidvw,aGtU_Wkp_lOCs9VQTXC6sw,gittGGXtM4KDoK1KX7f6XA,1,0.136363636,and god forbid if you moved to a new house and need to get new keys to your mail box
273456,yKVcrphxEG2NNA47rDidvw,aGtU_Wkp_lOCs9VQTXC6sw,gittGGXtM4KDoK1KX7f6XA,1,0,i was quoted 2 weeks to a month and its now been over a month
273457,yKVcrphxEG2NNA47rDidvw,aGtU_Wkp_lOCs9VQTXC6sw,gittGGXtM4KDoK1KX7f6XA,1,0,standing in line i've seen them tell people multiples times that they don't know where their mail is
273458,yKVcrphxEG2NNA47rDidvw,aGtU_Wkp_lOCs9VQTXC6sw,gittGGXtM4KDoK1KX7f6XA,1,0.2,isn't that their job?!  i've never seen a more unorganized business filled with unhelpful and rude people
273459,yKVcrphxEG2NNA47rDidvw,aGtU_Wkp_lOCs9VQTXC6sw,gittGGXtM4KDoK1KX7f6XA,1,0.213888889,i'm not the kind of person who gets angry easily or who ever complains but this place makes me furious!
273460,hbWeyzYOUqAVLh03Lz8zKw,aGtU_Wkp_lOCs9VQTXC6sw,SApw-W1F32NXEUuxQ-wEHw,1,-0.0046813,"if i could give them 0 stars i would! horrible system, waited 45 minutes to pick up mail cause they only had one person and one line going at a time! i got here right when they opened and there was already a line waiting and the workers didn't seem to be in any kind of hurry!!! the most ridiculous thing ever!!!!"
273461,XFJrfJhFBSKmUOj5bW1hTg,aGtU_Wkp_lOCs9VQTXC6sw,D_eZqNsK5rz_InGUH6nMJA,1,-0.2125,the pickup line extended from one side of the building to the other and the progress was painfully slow; but that's not why i'm leaving this review
273462,XFJrfJhFBSKmUOj5bW1hTg,aGtU_Wkp_lOCs9VQTXC6sw,D_eZqNsK5rz_InGUH6nMJA,1,0.033333333,"today one the customers was an old chinese woman who did not know english, when the employee asked her to sign the pickup sheet the customer didn't understand"
273463,XFJrfJhFBSKmUOj5bW1hTg,aGtU_Wkp_lOCs9VQTXC6sw,D_eZqNsK5rz_InGUH6nMJA,1,-0.3,the employee started making rude remarks when the customer tried to call her daughter so she could explain
273464,XFJrfJhFBSKmUOj5bW1hTg,aGtU_Wkp_lOCs9VQTXC6sw,D_eZqNsK5rz_InGUH6nMJA,1,0.1,the employee went as far as to touch the woman and her phone
273465,XFJrfJhFBSKmUOj5bW1hTg,aGtU_Wkp_lOCs9VQTXC6sw,D_eZqNsK5rz_InGUH6nMJA,1,-0.7,"it was so bad that i remembered her name, ""halina"
273466,XFJrfJhFBSKmUOj5bW1hTg,aGtU_Wkp_lOCs9VQTXC6sw,D_eZqNsK5rz_InGUH6nMJA,1,-0.166666667,""" i've been to this office before, the employees are not quick or helpful"
273467,XFJrfJhFBSKmUOj5bW1hTg,aGtU_Wkp_lOCs9VQTXC6sw,D_eZqNsK5rz_InGUH6nMJA,1,-0.3,the least they can do is treat their customers with respect
273468,sF0dwvDJzrTfZ373ANGlHw,aGtU_Wkp_lOCs9VQTXC6sw,77GZrLVqrtnXjPPr7HWtfw,1,0,trying to call about another piece of mail that i didn't recieve
273469,sF0dwvDJzrTfZ373ANGlHw,aGtU_Wkp_lOCs9VQTXC6sw,77GZrLVqrtnXjPPr7HWtfw,1,0,"someone picks up the phone,  i start explaining my issue"
273470,sF0dwvDJzrTfZ373ANGlHw,aGtU_Wkp_lOCs9VQTXC6sw,77GZrLVqrtnXjPPr7HWtfw,1,0.05,"i was hung up on, then i called back and it went to a busy signal"
273471,sF0dwvDJzrTfZ373ANGlHw,aGtU_Wkp_lOCs9VQTXC6sw,77GZrLVqrtnXjPPr7HWtfw,1,-0.277777778,"what is that about?  poor service inside too,  we dont need to be talked down too when being told how to tape  a package"
273472,ktd0HdnvjKoH-QNPgQxa6g,aGtU_Wkp_lOCs9VQTXC6sw,z3PbWwpw4UH8cgD3wIsuRg,1,0,this place is a nightmare especially if you are in the pickup line
273473,ktd0HdnvjKoH-QNPgQxa6g,aGtU_Wkp_lOCs9VQTXC6sw,z3PbWwpw4UH8cgD3wIsuRg,1,0.136363636,i went there to pick up keys and after over an hour wait the clerk said they don't have them it's bc it's a new house it's the builders fault
273474,ktd0HdnvjKoH-QNPgQxa6g,aGtU_Wkp_lOCs9VQTXC6sw,z3PbWwpw4UH8cgD3wIsuRg,1,0.125,really?!? she said they will hold the mail for me to come back and to contact my builder
273475,ktd0HdnvjKoH-QNPgQxa6g,aGtU_Wkp_lOCs9VQTXC6sw,z3PbWwpw4UH8cgD3wIsuRg,1,-0.159722222,"what do you mean the builder???  anyway,  i came back today, waited again and to find out the previous clerk didn't do anything to hold the mail"
273476,ktd0HdnvjKoH-QNPgQxa6g,aGtU_Wkp_lOCs9VQTXC6sw,z3PbWwpw4UH8cgD3wIsuRg,1,0,"they let me know that they lost my keys, they don't have my mail, it's their fault and they will rush my keys which will take 2-4weeks"
273477,ktd0HdnvjKoH-QNPgQxa6g,aGtU_Wkp_lOCs9VQTXC6sw,z3PbWwpw4UH8cgD3wIsuRg,1,-0.4,"in the meantime, keep coming back  and wait in this stupid unorganized place to receive my mail"
273478,ktd0HdnvjKoH-QNPgQxa6g,aGtU_Wkp_lOCs9VQTXC6sw,z3PbWwpw4UH8cgD3wIsuRg,1,0.1,i wish the post office became obsolete completely
273479,ktd0HdnvjKoH-QNPgQxa6g,aGtU_Wkp_lOCs9VQTXC6sw,z3PbWwpw4UH8cgD3wIsuRg,1,0,thankful for ups and fedex!
273480,VgmPpiVtopg7ZX68jApilQ,aGtU_Wkp_lOCs9VQTXC6sw,upKnMp_-ds3GFnRTqd3OVg,1,0,"i've only had to pick up packages and mail here, so my only experience is with the dreaded pick up line"
273481,VgmPpiVtopg7ZX68jApilQ,aGtU_Wkp_lOCs9VQTXC6sw,upKnMp_-ds3GFnRTqd3OVg,1,0,for some reason there is only one employee who will retrieve packages and certified letters but several employees who work the windows where they take your money to mail packages or letters
273482,VgmPpiVtopg7ZX68jApilQ,aGtU_Wkp_lOCs9VQTXC6sw,upKnMp_-ds3GFnRTqd3OVg,1,-0.125,"it doesn't matter if there are 15 people waiting in the pick up line, the other employees will always take customers from the paying line as soon as they walk up"
273483,VgmPpiVtopg7ZX68jApilQ,aGtU_Wkp_lOCs9VQTXC6sw,upKnMp_-ds3GFnRTqd3OVg,1,-0.3,"when i went there this morning to pick up a certified letter, i felt like i was in a slow motion movie"
273484,VgmPpiVtopg7ZX68jApilQ,aGtU_Wkp_lOCs9VQTXC6sw,upKnMp_-ds3GFnRTqd3OVg,1,-0.042857143,at a certain point my husband and i just started laughing at how ridiculously slowly every employee was moving
273485,VgmPpiVtopg7ZX68jApilQ,aGtU_Wkp_lOCs9VQTXC6sw,upKnMp_-ds3GFnRTqd3OVg,1,0,i wish there was another option besides going to the post office
273486,VgmPpiVtopg7ZX68jApilQ,aGtU_Wkp_lOCs9VQTXC6sw,upKnMp_-ds3GFnRTqd3OVg,1,0,it's no surprise this place is going bankrupt
273487,Kl7L4GbqQ2aP-uNFM89nBg,aGtU_Wkp_lOCs9VQTXC6sw,5F8JCF7I-0kfFzTfVtSdVA,1,-0.05,"i used to be a big proponent of keeping the us postal service in business, but over the past year, my mind has changed completely"
273488,Kl7L4GbqQ2aP-uNFM89nBg,aGtU_Wkp_lOCs9VQTXC6sw,5F8JCF7I-0kfFzTfVtSdVA,1,0.25,"most recently, i sent a package to some friends in england"
273489,Kl7L4GbqQ2aP-uNFM89nBg,aGtU_Wkp_lOCs9VQTXC6sw,5F8JCF7I-0kfFzTfVtSdVA,1,0,over a month had gone by and they still hadn't received the shipment
273490,Kl7L4GbqQ2aP-uNFM89nBg,aGtU_Wkp_lOCs9VQTXC6sw,5F8JCF7I-0kfFzTfVtSdVA,1,0,"one day, a box showed up at our door"
273491,Kl7L4GbqQ2aP-uNFM89nBg,aGtU_Wkp_lOCs9VQTXC6sw,5F8JCF7I-0kfFzTfVtSdVA,1,0,"it was the box that we had sent out about 5 weeks prior, except it had no contents"
273492,Kl7L4GbqQ2aP-uNFM89nBg,aGtU_Wkp_lOCs9VQTXC6sw,5F8JCF7I-0kfFzTfVtSdVA,1,-0.1,the box looked as though it had been ripped open and the books that i had sent to their children were missing
273493,Kl7L4GbqQ2aP-uNFM89nBg,aGtU_Wkp_lOCs9VQTXC6sw,5F8JCF7I-0kfFzTfVtSdVA,1,0,the post office on russell road could not help me at all
273494,Kl7L4GbqQ2aP-uNFM89nBg,aGtU_Wkp_lOCs9VQTXC6sw,5F8JCF7I-0kfFzTfVtSdVA,1,0,"they told me they didn't know what happened, and despite the message on the package saying it had made it to los angeles, they told me it never actually left las vegas (according to their report they printed over the computer)"
