,review_id,business_id,user_id,stars,blob_polarity,review
270542,bm0IgZIoifmhRGU3v79H3Q,J5933HyJSsVJzCtPLv3OiQ,ru8p3RTlk8f9LB_3zLXURQ,5,0.108333333,tranquility trail is a very peaceful and low key place
270543,bm0IgZIoifmhRGU3v79H3Q,J5933HyJSsVJzCtPLv3OiQ,ru8p3RTlk8f9LB_3zLXURQ,5,0.05,the moment you open the door there is soft music playing and you can take your time cleaning out the bunny cages
270544,bm0IgZIoifmhRGU3v79H3Q,J5933HyJSsVJzCtPLv3OiQ,ru8p3RTlk8f9LB_3zLXURQ,5,0.160416667,my son and i like to talk and play with the bunnies while we clean and we also enjoy talking to the other regular volunteers there
270545,bm0IgZIoifmhRGU3v79H3Q,J5933HyJSsVJzCtPLv3OiQ,ru8p3RTlk8f9LB_3zLXURQ,5,0.4,bunnies really do have their own personalities as i'm learning
270546,bm0IgZIoifmhRGU3v79H3Q,J5933HyJSsVJzCtPLv3OiQ,ru8p3RTlk8f9LB_3zLXURQ,5,0.416666667,"it would make a lot of sense but when most of the bunnies are kept in small cages, there isn't a lot of room to jump (get the pun?) for joy!  "
270547,bm0IgZIoifmhRGU3v79H3Q,J5933HyJSsVJzCtPLv3OiQ,ru8p3RTlk8f9LB_3zLXURQ,5,0.65,this is also a great place to teach litte ones about love and care in a non intimidating environment
270548,bm0IgZIoifmhRGU3v79H3Q,J5933HyJSsVJzCtPLv3OiQ,ru8p3RTlk8f9LB_3zLXURQ,5,0.422222222,and hands down the best place to adopt a bunny
270549,bm0IgZIoifmhRGU3v79H3Q,J5933HyJSsVJzCtPLv3OiQ,ru8p3RTlk8f9LB_3zLXURQ,5,0.592857143,"yelp has incredible search engine mojo so i hope any time someone does a search for bunny info, my reviews on tranquility trail pops right up"
270550,bm0IgZIoifmhRGU3v79H3Q,J5933HyJSsVJzCtPLv3OiQ,ru8p3RTlk8f9LB_3zLXURQ,5,0.3,"oh, psst, tranquility trail is plenty busy on weekends with volunteers but could use some more volunteers during the week"
270551,bm0IgZIoifmhRGU3v79H3Q,J5933HyJSsVJzCtPLv3OiQ,ru8p3RTlk8f9LB_3zLXURQ,5,0.2,i find it very relaxing in there
270552,bm0IgZIoifmhRGU3v79H3Q,J5933HyJSsVJzCtPLv3OiQ,ru8p3RTlk8f9LB_3zLXURQ,5,0,"have a couple of hours or two to spare, give kelly a call and sign up for volunteer orientation!!!!"
270553,8LdfDWhDQf0fy2eU5yGzqQ,J5933HyJSsVJzCtPLv3OiQ,end_MgtstZiT9Yt2E4WWYw,1,1,"as others have stated, it's wonderful to work with bunnies and learn to care for them"
270554,8LdfDWhDQf0fy2eU5yGzqQ,J5933HyJSsVJzCtPLv3OiQ,end_MgtstZiT9Yt2E4WWYw,1,0.43,my high schooler started going there to earn community service hours and she loved taking care of the bunnies and learning their personalities
270555,8LdfDWhDQf0fy2eU5yGzqQ,J5933HyJSsVJzCtPLv3OiQ,end_MgtstZiT9Yt2E4WWYw,1,0.45,she loved it so much she overbooked herself and had to send an email (as requested) to change her schedule
270556,8LdfDWhDQf0fy2eU5yGzqQ,J5933HyJSsVJzCtPLv3OiQ,end_MgtstZiT9Yt2E4WWYw,1,0,she received a response email thanking her for letting them know
270557,8LdfDWhDQf0fy2eU5yGzqQ,J5933HyJSsVJzCtPLv3OiQ,end_MgtstZiT9Yt2E4WWYw,1,0,"the next time she went in to volunteer, she was chastised for not letting them know and that she couldn't come back if it happened again"
270558,8LdfDWhDQf0fy2eU5yGzqQ,J5933HyJSsVJzCtPLv3OiQ,end_MgtstZiT9Yt2E4WWYw,1,-0.1,"when she stated that she had sent an email and received a response, she was told they never got it!  a few weeks later, we had a schedule conflict so i called them since emailing didn't work"
270559,8LdfDWhDQf0fy2eU5yGzqQ,J5933HyJSsVJzCtPLv3OiQ,end_MgtstZiT9Yt2E4WWYw,1,-0.5,"i was told that my  daughter should email them about the cancellation and when i explained what happened before, she said that she was given the wrong date (huh?)"
270560,8LdfDWhDQf0fy2eU5yGzqQ,J5933HyJSsVJzCtPLv3OiQ,end_MgtstZiT9Yt2E4WWYw,1,0.025,then she said that my daughter was obviously 'not a good fit'
270561,8LdfDWhDQf0fy2eU5yGzqQ,J5933HyJSsVJzCtPLv3OiQ,end_MgtstZiT9Yt2E4WWYw,1,0.270833333,"must be nice to have so many volunteers that you can kick someone out for doing what they were told to!  overall, nice working with the animals but the people in charge are rude, condescending, and completely unreliable"
270562,HK89C4sgCkZvyvY8KqXlUQ,J5933HyJSsVJzCtPLv3OiQ,QuPAW8bXVUrT89JHRywJaQ,1,0.136363636,i called tranquility trail in january in to inquire about finding a new companion for one of my rabbits who's sister passed away from cancer
270563,HK89C4sgCkZvyvY8KqXlUQ,J5933HyJSsVJzCtPLv3OiQ,QuPAW8bXVUrT89JHRywJaQ,1,0,they never called me back
270564,HK89C4sgCkZvyvY8KqXlUQ,J5933HyJSsVJzCtPLv3OiQ,QuPAW8bXVUrT89JHRywJaQ,1,0,one would think a no kill shelter would look into all potential adopters
270565,HK89C4sgCkZvyvY8KqXlUQ,J5933HyJSsVJzCtPLv3OiQ,QuPAW8bXVUrT89JHRywJaQ,1,0.2,very unprofessional
270566,UksJSb-uer8MS5-08YiiWQ,J5933HyJSsVJzCtPLv3OiQ,zw2jx70RaKSE5k1sW9e3Gw,5,0,"if i was a bunny in a shelter, waiting for a forever home, i would want to be a bunny in this shelter"
270567,UksJSb-uer8MS5-08YiiWQ,J5933HyJSsVJzCtPLv3OiQ,zw2jx70RaKSE5k1sW9e3Gw,5,0.7,there is no question that all the rabbits are deeply loved and cared for here
270568,UksJSb-uer8MS5-08YiiWQ,J5933HyJSsVJzCtPLv3OiQ,zw2jx70RaKSE5k1sW9e3Gw,5,0.554166667,the staff and volunteers are pleasant and friendly to all who come in the doors
270569,UksJSb-uer8MS5-08YiiWQ,J5933HyJSsVJzCtPLv3OiQ,zw2jx70RaKSE5k1sW9e3Gw,5,0.583333333,"one is welcome to walk through the facility, which is always so clean, and any questions are answered"
270570,UksJSb-uer8MS5-08YiiWQ,J5933HyJSsVJzCtPLv3OiQ,zw2jx70RaKSE5k1sW9e3Gw,5,0,i appreciate that they have strict guidelines for adopting a rabbit
270571,UksJSb-uer8MS5-08YiiWQ,J5933HyJSsVJzCtPLv3OiQ,zw2jx70RaKSE5k1sW9e3Gw,5,0.404761905,they want to be absolutely certain the rabbits will be going to the best homes possible
270572,UksJSb-uer8MS5-08YiiWQ,J5933HyJSsVJzCtPLv3OiQ,zw2jx70RaKSE5k1sW9e3Gw,5,0.227272727,i have always had a positive experience every time i have come to visit
270573,UksJSb-uer8MS5-08YiiWQ,J5933HyJSsVJzCtPLv3OiQ,zw2jx70RaKSE5k1sW9e3Gw,5,0.8,"whether to say hello to the bunnies or shop in the retail store, i have always felt welcome"
270574,vtS-UJzSF-gy7dphNeFp5Q,J5933HyJSsVJzCtPLv3OiQ,orKofJvF9wsmA3AVVqtklQ,5,0.5625,tranquility trail is my kids favorite place! they absolutely love volunteering here
270575,vtS-UJzSF-gy7dphNeFp5Q,J5933HyJSsVJzCtPLv3OiQ,orKofJvF9wsmA3AVVqtklQ,5,-0.2,it was really difficult finding an animal shelter that would allow my 6 and 10 year old children to volunteer
270576,vtS-UJzSF-gy7dphNeFp5Q,J5933HyJSsVJzCtPLv3OiQ,orKofJvF9wsmA3AVVqtklQ,5,0,my wife and i were elated when a friend told us about this place
270577,vtS-UJzSF-gy7dphNeFp5Q,J5933HyJSsVJzCtPLv3OiQ,orKofJvF9wsmA3AVVqtklQ,5,1,we have been volunteering for over a year and it has been the best experience for my kids
270578,vtS-UJzSF-gy7dphNeFp5Q,J5933HyJSsVJzCtPLv3OiQ,orKofJvF9wsmA3AVVqtklQ,5,0.1525,i was a little skeptical at first with how great my friend made it sound but i thought we would give it a try
270579,vtS-UJzSF-gy7dphNeFp5Q,J5933HyJSsVJzCtPLv3OiQ,orKofJvF9wsmA3AVVqtklQ,5,0.6,"having volunteered at a lot of places, i can honestly say this is the cleanest and happiest shelter i have ever visited with the kindest people running it"
270580,vtS-UJzSF-gy7dphNeFp5Q,J5933HyJSsVJzCtPLv3OiQ,orKofJvF9wsmA3AVVqtklQ,5,0.133333333,the staff has really treated my children with such respect and kindness and have really taught them to respect the animals too
270581,vtS-UJzSF-gy7dphNeFp5Q,J5933HyJSsVJzCtPLv3OiQ,orKofJvF9wsmA3AVVqtklQ,5,0.24,they have learned so much from this experience and i really appreciate the opportunity this shelter has given my family to serve our community together in such a fun and rewarding way
270582,vtS-UJzSF-gy7dphNeFp5Q,J5933HyJSsVJzCtPLv3OiQ,orKofJvF9wsmA3AVVqtklQ,5,0.25,my kids also can't wait for their summer camp in july! i highly recommend this shelter to everyone! i wish every shelter could be just like this one!
270583,OAIwoxGJ3B0LYDKfZ7aEBQ,J5933HyJSsVJzCtPLv3OiQ,ZWhyLK9MpAUVqazL5BP-sQ,5,0.5,this place is better than words can describe
270584,OAIwoxGJ3B0LYDKfZ7aEBQ,J5933HyJSsVJzCtPLv3OiQ,ZWhyLK9MpAUVqazL5BP-sQ,5,1,they give the best care that a bunny can get
270585,OAIwoxGJ3B0LYDKfZ7aEBQ,J5933HyJSsVJzCtPLv3OiQ,ZWhyLK9MpAUVqazL5BP-sQ,5,0.433333333,they allow you to visit with all of the bunnies (and if you get there at a good time you can help pass out daily treats) and they know each bunny and their personality like their own pet
270586,OAIwoxGJ3B0LYDKfZ7aEBQ,J5933HyJSsVJzCtPLv3OiQ,ZWhyLK9MpAUVqazL5BP-sQ,5,1,wonderful wonderful people who truly care about the well being of animals
270587,OAIwoxGJ3B0LYDKfZ7aEBQ,J5933HyJSsVJzCtPLv3OiQ,ZWhyLK9MpAUVqazL5BP-sQ,5,0.75,their store is stocked with the best rabbit toys and treats and top of the line pellets and hay
270588,OAIwoxGJ3B0LYDKfZ7aEBQ,J5933HyJSsVJzCtPLv3OiQ,ZWhyLK9MpAUVqazL5BP-sQ,5,0.473214286,"they even do special events for their bunnies like the superbowl party and nights out on binkytown! i love to visit here, i wish i lived close so i could volunteer"
270589,OAIwoxGJ3B0LYDKfZ7aEBQ,J5933HyJSsVJzCtPLv3OiQ,ZWhyLK9MpAUVqazL5BP-sQ,5,0,thank you to all that have a part in ttas and for all you do for the bunnies!
270590,I7QT23nt4duk6TdQxkrAFQ,zn2hrgnzF9zn_RPszha6FQ,slJrbI92rtg04ybQmOiEcQ,4,0.7,loved this place
270591,I7QT23nt4duk6TdQxkrAFQ,zn2hrgnzF9zn_RPszha6FQ,slJrbI92rtg04ybQmOiEcQ,4,0.136363636,i was working in nc during this week and timed things so i could be in charlotte to go see the new nascar hof
270592,I7QT23nt4duk6TdQxkrAFQ,zn2hrgnzF9zn_RPszha6FQ,slJrbI92rtg04ybQmOiEcQ,4,0,"i went on wednesday may 12th, the second day it was open"
270593,I7QT23nt4duk6TdQxkrAFQ,zn2hrgnzF9zn_RPszha6FQ,slJrbI92rtg04ybQmOiEcQ,4,0.106666667,"surprisingly, there were very few outside waiting to get in and overall, was very uncrowded the entire time i was there"
270594,I7QT23nt4duk6TdQxkrAFQ,zn2hrgnzF9zn_RPszha6FQ,slJrbI92rtg04ybQmOiEcQ,4,-0.163888889,"i am not a huge die hard nascar fan but overall, i am in to all types of motor racing"
270595,I7QT23nt4duk6TdQxkrAFQ,zn2hrgnzF9zn_RPszha6FQ,slJrbI92rtg04ybQmOiEcQ,4,0,so i could not pass up a chance to see this spectacle
270596,I7QT23nt4duk6TdQxkrAFQ,zn2hrgnzF9zn_RPszha6FQ,slJrbI92rtg04ybQmOiEcQ,4,0.2,it's very well done
270597,I7QT23nt4duk6TdQxkrAFQ,zn2hrgnzF9zn_RPszha6FQ,slJrbI92rtg04ybQmOiEcQ,4,0,tons of things to see and do
270598,I7QT23nt4duk6TdQxkrAFQ,zn2hrgnzF9zn_RPszha6FQ,slJrbI92rtg04ybQmOiEcQ,4,0,"lots of staff everywhere to tell you about the various displays, offering to take your photo in front of cars etc"
270599,I7QT23nt4duk6TdQxkrAFQ,zn2hrgnzF9zn_RPszha6FQ,slJrbI92rtg04ybQmOiEcQ,4,0.05,a huge amount of history in here that every nascar fan should go and see at least once
270600,ANIhWtY-Y6Nb-RQSF8NZBg,zn2hrgnzF9zn_RPszha6FQ,_AISZA8ju1JIyQCwpwNIYA,4,0.8,we had a great time here
270601,ANIhWtY-Y6Nb-RQSF8NZBg,zn2hrgnzF9zn_RPszha6FQ,_AISZA8ju1JIyQCwpwNIYA,4,0.3,"the place wasn't too busy and the exhibits were interesting, although it seemed as if a lot of people were struggling to understand how to use some of the hands-on exhibits"
270602,ANIhWtY-Y6Nb-RQSF8NZBg,zn2hrgnzF9zn_RPszha6FQ,_AISZA8ju1JIyQCwpwNIYA,4,0,"i think this place will improve the longer it remains open, but i would definitely go, especially if you're a nascar fan"
270603,aatYJWq0T79-0yOCSnLcIQ,zn2hrgnzF9zn_RPszha6FQ,W_Cy_GTwJGWfyg2_W6S6jg,4,0.166666667,you know what?  i don't particularly like nascar
270604,aatYJWq0T79-0yOCSnLcIQ,zn2hrgnzF9zn_RPszha6FQ,W_Cy_GTwJGWfyg2_W6S6jg,4,0.2,"i think i might have caught part of a race here or there, but i don't care for it all that much"
270605,aatYJWq0T79-0yOCSnLcIQ,zn2hrgnzF9zn_RPszha6FQ,W_Cy_GTwJGWfyg2_W6S6jg,4,0.213333333,"i do know jeff gordon mainly because he's one of the few names that put vallejo in a good light (seeing as all the news that seems to come out of my current city is bankruptcy, foreclosure, murder and prostitution"
270606,aatYJWq0T79-0yOCSnLcIQ,zn2hrgnzF9zn_RPszha6FQ,W_Cy_GTwJGWfyg2_W6S6jg,4,0.25,"i'm telling you all this because even if you're not a huge nascar fan, or even if you're not into it at all, i think you'll have a good time here at the nascar hall of fame"
270607,aatYJWq0T79-0yOCSnLcIQ,zn2hrgnzF9zn_RPszha6FQ,W_Cy_GTwJGWfyg2_W6S6jg,4,0.066666667,"even if you're not into cars, you can't help but admire some sweet-ass rides and the exhibit where they show you what goes on behind the scenes (changing tires, trailer, simulator, etc) is pretty cool too"
270608,aatYJWq0T79-0yOCSnLcIQ,zn2hrgnzF9zn_RPszha6FQ,W_Cy_GTwJGWfyg2_W6S6jg,4,0.277777778,"all in all, we spent close to 2 hours here and i know that if you're a fan you could easily spend most of a day salivating over the cars and their drivers"
270609,aatYJWq0T79-0yOCSnLcIQ,zn2hrgnzF9zn_RPszha6FQ,W_Cy_GTwJGWfyg2_W6S6jg,4,0.375,this place is very much worth checking out!
270610,3qfwOnwqDTIG4lrkiQoK2Q,zn2hrgnzF9zn_RPszha6FQ,QHKWB42JjbtBKNZQOkbheA,5,0.5,okay
270611,3qfwOnwqDTIG4lrkiQoK2Q,zn2hrgnzF9zn_RPszha6FQ,QHKWB42JjbtBKNZQOkbheA,5,0,yes
270612,3qfwOnwqDTIG4lrkiQoK2Q,zn2hrgnzF9zn_RPszha6FQ,QHKWB42JjbtBKNZQOkbheA,5,0,i know
270613,3qfwOnwqDTIG4lrkiQoK2Q,zn2hrgnzF9zn_RPszha6FQ,QHKWB42JjbtBKNZQOkbheA,5,0,"i am not a fan of nascar, but i just gave the hall of fame five stars"
270614,3qfwOnwqDTIG4lrkiQoK2Q,zn2hrgnzF9zn_RPszha6FQ,QHKWB42JjbtBKNZQOkbheA,5,0,you know why? 
270615,3qfwOnwqDTIG4lrkiQoK2Q,zn2hrgnzF9zn_RPszha6FQ,QHKWB42JjbtBKNZQOkbheA,5,0,"the racing simulator, on which my qualifying lap times spanked r's"
270616,3qfwOnwqDTIG4lrkiQoK2Q,zn2hrgnzF9zn_RPszha6FQ,QHKWB42JjbtBKNZQOkbheA,5,0.37,"the museum is actually really educational in regard to north carolina/southern history, and it's amazingly interactive, very modern"
270617,3qfwOnwqDTIG4lrkiQoK2Q,zn2hrgnzF9zn_RPszha6FQ,QHKWB42JjbtBKNZQOkbheA,5,0.1875,"even if you're not into nascar at all, as i am not (as traffic from the race held in october made me over an hour late for my own sweet sixteen held near concord mills"
270618,3qfwOnwqDTIG4lrkiQoK2Q,zn2hrgnzF9zn_RPszha6FQ,QHKWB42JjbtBKNZQOkbheA,5,0,it's been nearly ten years and i have still not forgotten
270619,3qfwOnwqDTIG4lrkiQoK2Q,zn2hrgnzF9zn_RPszha6FQ,QHKWB42JjbtBKNZQOkbheA,5,0,hmph
270620,3qfwOnwqDTIG4lrkiQoK2Q,zn2hrgnzF9zn_RPszha6FQ,QHKWB42JjbtBKNZQOkbheA,5,0.3,"), it's still worth a visit"
270621,3qfwOnwqDTIG4lrkiQoK2Q,zn2hrgnzF9zn_RPszha6FQ,QHKWB42JjbtBKNZQOkbheA,5,0.233333333,"i'm not used to paying for museums, god bless the smithsonian instituition, but i suppose it's worth the price of admission, particularly to support charlotte's tourism economy"
270622,EkJS5i_yrqtedXFVCSSSTQ,zn2hrgnzF9zn_RPszha6FQ,Xka9DFYAEVOow2zxdmtT6A,3,0.3,"great place to check out, even if you're not a huge nascar fan"
270623,EkJS5i_yrqtedXFVCSSSTQ,zn2hrgnzF9zn_RPszha6FQ,Xka9DFYAEVOow2zxdmtT6A,3,0.441666667,everyone working was really friendly and willing to show you a good time
270624,EkJS5i_yrqtedXFVCSSSTQ,zn2hrgnzF9zn_RPszha6FQ,Xka9DFYAEVOow2zxdmtT6A,3,0.375,the pit crew challenge was really fun!  i won
270625,EkJS5i_yrqtedXFVCSSSTQ,zn2hrgnzF9zn_RPszha6FQ,Xka9DFYAEVOow2zxdmtT6A,3,0,just saying
270626,EkJS5i_yrqtedXFVCSSSTQ,zn2hrgnzF9zn_RPszha6FQ,Xka9DFYAEVOow2zxdmtT6A,3,0.133333333,"the simulator ride is very similar to the actual ""qualifying"" simulators (which are free)"
270627,EkJS5i_yrqtedXFVCSSSTQ,zn2hrgnzF9zn_RPszha6FQ,Xka9DFYAEVOow2zxdmtT6A,3,0.133333333,"we had a few sub 2 year old kids, so we missed the movie and i won't be able to comment on it"
270628,EkJS5i_yrqtedXFVCSSSTQ,zn2hrgnzF9zn_RPszha6FQ,Xka9DFYAEVOow2zxdmtT6A,3,-0.07,"it's not really a place for young kids, even the ""kid zone"" is small and not a whole lot to do for younger ones"
270629,EkJS5i_yrqtedXFVCSSSTQ,zn2hrgnzF9zn_RPszha6FQ,Xka9DFYAEVOow2zxdmtT6A,3,0,there is also a nascar trailer and its neat to see how the inside of the trailers are set up in the tractor trailers that you see on the highway!  so yea
270630,EkJS5i_yrqtedXFVCSSSTQ,zn2hrgnzF9zn_RPszha6FQ,Xka9DFYAEVOow2zxdmtT6A,3,0.9765625,"i'll be able to say ""i know what's inside"" booyea!!!"
270631,EkJS5i_yrqtedXFVCSSSTQ,zn2hrgnzF9zn_RPszha6FQ,Xka9DFYAEVOow2zxdmtT6A,3,0.5,:)
270632,EkJS5i_yrqtedXFVCSSSTQ,zn2hrgnzF9zn_RPszha6FQ,Xka9DFYAEVOow2zxdmtT6A,3,0.65,"they also have a sloped ramp that you can check out the nascar cars evolution!  it's very interesting to see the progression of clumpy, non aerodynamic steel death traps to the fancy fiberglass ones that we've all grown up with"
270633,EkJS5i_yrqtedXFVCSSSTQ,zn2hrgnzF9zn_RPszha6FQ,Xka9DFYAEVOow2zxdmtT6A,3,0.270833333,one interesting feature of the ramp is that you can see the slope of the actual race tracks!  they're pretty steep! 
270634,EkJS5i_yrqtedXFVCSSSTQ,zn2hrgnzF9zn_RPszha6FQ,Xka9DFYAEVOow2zxdmtT6A,3,0,yay
270635,EkJS5i_yrqtedXFVCSSSTQ,zn2hrgnzF9zn_RPszha6FQ,Xka9DFYAEVOow2zxdmtT6A,3,0,nascar!
270636,xxh_zgzppJgzlE9vLlz3QQ,zn2hrgnzF9zn_RPszha6FQ,j_1y_eHdTNWzy2KuiliP0A,3,-0.15,we were in the area for christmas and we spent a few hours here
270637,xxh_zgzppJgzlE9vLlz3QQ,zn2hrgnzF9zn_RPszha6FQ,j_1y_eHdTNWzy2KuiliP0A,3,0.35,not a bad way to spend part of a day
270638,xxh_zgzppJgzlE9vLlz3QQ,zn2hrgnzF9zn_RPszha6FQ,j_1y_eHdTNWzy2KuiliP0A,3,0.366785714,the layout of the space is very cool and it is a very large space
270639,xxh_zgzppJgzlE9vLlz3QQ,zn2hrgnzF9zn_RPszha6FQ,j_1y_eHdTNWzy2KuiliP0A,3,0.35,it's 20 bucks for an adult pass which is kind of steep but it is a tourist attraction
270640,xxh_zgzppJgzlE9vLlz3QQ,zn2hrgnzF9zn_RPszha6FQ,j_1y_eHdTNWzy2KuiliP0A,3,0.322222222,having so many older race cars on display made it worth it the price of admission
270641,xxh_zgzppJgzlE9vLlz3QQ,zn2hrgnzF9zn_RPszha6FQ,j_1y_eHdTNWzy2KuiliP0A,3,0.2375,"the interactive displays were cool and i enjoyed looking at items from the history of nascar, especially the really old stuff"
270642,xxh_zgzppJgzlE9vLlz3QQ,zn2hrgnzF9zn_RPszha6FQ,j_1y_eHdTNWzy2KuiliP0A,3,0.233333333,the nascar hall of fame does a good job of showing why nascar has such a following
270643,xxh_zgzppJgzlE9vLlz3QQ,zn2hrgnzF9zn_RPszha6FQ,j_1y_eHdTNWzy2KuiliP0A,3,0.5,"the movie about the history of nascar is worth seeing, it was in fact the best part of the whole experience for me"
270644,xxh_zgzppJgzlE9vLlz3QQ,zn2hrgnzF9zn_RPszha6FQ,j_1y_eHdTNWzy2KuiliP0A,3,0.625,"not being a fan of nascar, i was pretty impressed with the nascar hall of fame"
270645,xxh_zgzppJgzlE9vLlz3QQ,zn2hrgnzF9zn_RPszha6FQ,j_1y_eHdTNWzy2KuiliP0A,3,0.15625,"i did not like that you have to exit out the gift shop, i know most attractions do it but it felt a little shameless"
270646,8uuS6Pk89QuyaPwcj1Gsuw,zn2hrgnzF9zn_RPszha6FQ,3h5zyiSxtClI0_QsO10DMA,4,0.5,lot more interactive than we thought it would be 
270647,8uuS6Pk89QuyaPwcj1Gsuw,zn2hrgnzF9zn_RPszha6FQ,3h5zyiSxtClI0_QsO10DMA,4,0,takes about 3-4 hours to do everything
270648,qWNjJbo9vvGQnYjvzOqPIA,zn2hrgnzF9zn_RPszha6FQ,E8NtcA1_i1KK6dJ4oFjGFw,5,-0.2,i have been to the nascar hall of fame a few times now
270649,qWNjJbo9vvGQnYjvzOqPIA,zn2hrgnzF9zn_RPszha6FQ,E8NtcA1_i1KK6dJ4oFjGFw,5,0,while it's been open for just 1 year it ranks 2nd of all the sports hall of fame's in attendance
270650,qWNjJbo9vvGQnYjvzOqPIA,zn2hrgnzF9zn_RPszha6FQ,E8NtcA1_i1KK6dJ4oFjGFw,5,0.166666667,"the only one visited more is the baseball hof, and was opened back in 1939"
270651,qWNjJbo9vvGQnYjvzOqPIA,zn2hrgnzF9zn_RPszha6FQ,E8NtcA1_i1KK6dJ4oFjGFw,5,0.8,great attraction to spend the day at even if you're not a fan of nascar
270652,qWNjJbo9vvGQnYjvzOqPIA,zn2hrgnzF9zn_RPszha6FQ,E8NtcA1_i1KK6dJ4oFjGFw,5,0,you may become one once you visit the hall of fame
270653,qWNjJbo9vvGQnYjvzOqPIA,zn2hrgnzF9zn_RPszha6FQ,E8NtcA1_i1KK6dJ4oFjGFw,5,0.6,the staff is amazing
270654,qWNjJbo9vvGQnYjvzOqPIA,zn2hrgnzF9zn_RPszha6FQ,E8NtcA1_i1KK6dJ4oFjGFw,5,0,do yourself a favor and take the time to visit it
270655,qWNjJbo9vvGQnYjvzOqPIA,zn2hrgnzF9zn_RPszha6FQ,E8NtcA1_i1KK6dJ4oFjGFw,5,0.4,it has a movie to view that tells the history that i recommend viewing and has alot of interactive areas for you to enjoy
270656,Dwe5e2LyVMfRSXw6HXEHdg,zn2hrgnzF9zn_RPszha6FQ,3saa8j5QfdDYuZ-3dKhbcw,5,0.5,"i had a couple hours to kill in charlotte and i do so love museums, so i wandered over to the nascar hall of fame"
270657,Dwe5e2LyVMfRSXw6HXEHdg,zn2hrgnzF9zn_RPszha6FQ,3saa8j5QfdDYuZ-3dKhbcw,5,-0.05,"it was much larger than i expected, and i suspect, set up to be used for events and receptions along with being a museum"
270658,Dwe5e2LyVMfRSXw6HXEHdg,zn2hrgnzF9zn_RPszha6FQ,3saa8j5QfdDYuZ-3dKhbcw,5,0,for $19
270659,Dwe5e2LyVMfRSXw6HXEHdg,zn2hrgnzF9zn_RPszha6FQ,3saa8j5QfdDYuZ-3dKhbcw,5,0.175,"95 you have access to the entire hall of fame, which you could spend probably a full afternoon wandering around if you are into nascar"
270660,Dwe5e2LyVMfRSXw6HXEHdg,zn2hrgnzF9zn_RPszha6FQ,3saa8j5QfdDYuZ-3dKhbcw,5,0,"i am not a big nascar fan, so i probably didn't get my $19"
270661,Dwe5e2LyVMfRSXw6HXEHdg,zn2hrgnzF9zn_RPszha6FQ,3saa8j5QfdDYuZ-3dKhbcw,5,0.4,"95 worth, but it was still interesting"
270662,Dwe5e2LyVMfRSXw6HXEHdg,zn2hrgnzF9zn_RPszha6FQ,3saa8j5QfdDYuZ-3dKhbcw,5,-0.1,"the exhibits themselves are well done, although the museum as a whole is slightly broken up, doesn't flow as well as it could"
270663,Dwe5e2LyVMfRSXw6HXEHdg,zn2hrgnzF9zn_RPszha6FQ,3saa8j5QfdDYuZ-3dKhbcw,5,0.15,there were more than a few interactive challenges and simulators to take advantage of
270664,Dwe5e2LyVMfRSXw6HXEHdg,zn2hrgnzF9zn_RPszha6FQ,3saa8j5QfdDYuZ-3dKhbcw,5,0.375,plenty of friendly staff just dying to help with questions
270665,Dwe5e2LyVMfRSXw6HXEHdg,zn2hrgnzF9zn_RPszha6FQ,3saa8j5QfdDYuZ-3dKhbcw,5,-0.5,if you're in charlotte it's really silly to not check out the nascar hall of fame
270666,Dwe5e2LyVMfRSXw6HXEHdg,zn2hrgnzF9zn_RPszha6FQ,3saa8j5QfdDYuZ-3dKhbcw,5,-0.1875,i even learned a little bit about nascar history and trivia that i shall use when pretending to know something about nascar
270667,Dr0tHRrnBc29DiNIn19Biw,zn2hrgnzF9zn_RPszha6FQ,gJj_Rmt9TllpdtIMSEhaQA,2,0,this is my #1 biggest concern
270668,Dr0tHRrnBc29DiNIn19Biw,zn2hrgnzF9zn_RPszha6FQ,gJj_Rmt9TllpdtIMSEhaQA,2,-0.166666667,"about half way through the hof, i realized it was lunch and decided to head over to the cafeteria"
270669,Dr0tHRrnBc29DiNIn19Biw,zn2hrgnzF9zn_RPszha6FQ,gJj_Rmt9TllpdtIMSEhaQA,2,-0.05,"as with places like this, i expected the food to be overpriced, but was not expecting to get totally ripped off"
270670,Dr0tHRrnBc29DiNIn19Biw,zn2hrgnzF9zn_RPszha6FQ,gJj_Rmt9TllpdtIMSEhaQA,2,0,a veggie wrap for $4
270671,Dr0tHRrnBc29DiNIn19Biw,zn2hrgnzF9zn_RPszha6FQ,gJj_Rmt9TllpdtIMSEhaQA,2,0.13125,"50 seemed like the best deal on the menu (and at least they do have a vegetarian option!) and perhaps it was, but it was much smaller than i expected"
270672,Dr0tHRrnBc29DiNIn19Biw,zn2hrgnzF9zn_RPszha6FQ,gJj_Rmt9TllpdtIMSEhaQA,2,0,"and since everything is made in the morning and already wrapped you cannot tell them ""no onions"" for instance"
270673,Dr0tHRrnBc29DiNIn19Biw,zn2hrgnzF9zn_RPszha6FQ,gJj_Rmt9TllpdtIMSEhaQA,2,0.5,food allergies will come into play a lot here i'm sure as you have to get the food the way it's made
270674,Dr0tHRrnBc29DiNIn19Biw,zn2hrgnzF9zn_RPszha6FQ,gJj_Rmt9TllpdtIMSEhaQA,2,0.15,"my husband chose to get a ""side salad"" and we laughed when we realized a side salad is not a smaller salad, but a small portion of macaroni salad or tomato and cheese salad"
270675,Dr0tHRrnBc29DiNIn19Biw,zn2hrgnzF9zn_RPszha6FQ,gJj_Rmt9TllpdtIMSEhaQA,2,0,we were both hungry when we left
270676,Dr0tHRrnBc29DiNIn19Biw,zn2hrgnzF9zn_RPszha6FQ,gJj_Rmt9TllpdtIMSEhaQA,2,-0.25,"we did not buy chips or candy, but you can get a small bag of chips for $1"
270677,Dr0tHRrnBc29DiNIn19Biw,zn2hrgnzF9zn_RPszha6FQ,gJj_Rmt9TllpdtIMSEhaQA,2,0,00 or a regular sized candy bar for $2
270678,Dr0tHRrnBc29DiNIn19Biw,zn2hrgnzF9zn_RPszha6FQ,gJj_Rmt9TllpdtIMSEhaQA,2,0,"00 if you're thirsty, you're in luck because they have soda, water, and juices, but they are the smallest bottles i've ever seen for $2"
270679,Dr0tHRrnBc29DiNIn19Biw,zn2hrgnzF9zn_RPszha6FQ,gJj_Rmt9TllpdtIMSEhaQA,2,0.5,00 (that was for the soda - juices may be more)
270680,Dr0tHRrnBc29DiNIn19Biw,zn2hrgnzF9zn_RPszha6FQ,gJj_Rmt9TllpdtIMSEhaQA,2,0.5,this is to encourage people to buy more i'm sure and to avoid sharing
270681,Dr0tHRrnBc29DiNIn19Biw,zn2hrgnzF9zn_RPszha6FQ,gJj_Rmt9TllpdtIMSEhaQA,2,0.433333333,they could easily sell them for $1
270682,Dr0tHRrnBc29DiNIn19Biw,zn2hrgnzF9zn_RPszha6FQ,gJj_Rmt9TllpdtIMSEhaQA,2,0.375,"00 a piece and still make a killing, but they are more interested in being greedy"
270683,Dr0tHRrnBc29DiNIn19Biw,zn2hrgnzF9zn_RPszha6FQ,gJj_Rmt9TllpdtIMSEhaQA,2,0,"when you enter the museum and when you leave the cafeteria area, you will see signs saying no outside food or drink and no food or drink outside of the cafe"
270684,Dr0tHRrnBc29DiNIn19Biw,zn2hrgnzF9zn_RPszha6FQ,gJj_Rmt9TllpdtIMSEhaQA,2,0.262857143,"i'm almost certain this is not to keep the exhibits safe, as mostly everything is behind glass, but a ploy to get you to spend more"
270685,Dr0tHRrnBc29DiNIn19Biw,zn2hrgnzF9zn_RPszha6FQ,gJj_Rmt9TllpdtIMSEhaQA,2,-0.166666667,"by the time you're half way through you'll be so thirsty, that you'll have to buy an overpriced drink, and then you'll see the sign saying you have to drink it all in the cafeteria area"
270686,Dr0tHRrnBc29DiNIn19Biw,zn2hrgnzF9zn_RPszha6FQ,gJj_Rmt9TllpdtIMSEhaQA,2,0,"there may have been water fountains by the bathrooms, but i doubt it"
270687,Dr0tHRrnBc29DiNIn19Biw,zn2hrgnzF9zn_RPszha6FQ,gJj_Rmt9TllpdtIMSEhaQA,2,0,so my #1 suggestion is to eat before you go and tuck a drink in your purse for later
270688,Dr0tHRrnBc29DiNIn19Biw,zn2hrgnzF9zn_RPszha6FQ,gJj_Rmt9TllpdtIMSEhaQA,2,0,second problem is their photos
270689,Dr0tHRrnBc29DiNIn19Biw,zn2hrgnzF9zn_RPszha6FQ,gJj_Rmt9TllpdtIMSEhaQA,2,0.2,"when you enter, they take your picture as though you're about to set sail on a cruise and then they charge you just as much for it"
